<!DOCTYPE html>
<html>
 <head id="head">
  <title>
   Nuclear Regulatory Commission
  </title>
  <meta content="Nuclear Regulatory Commission" name="description"/>
  <meta charset="utf-8"/>
  <meta content="noindex,nofollow" name="robots"/>
  <!-- Global site tag (gtag.js) - Google Analytics -->
  <script async="" src="https://www.googletagmanager.com/gtag/js?id=UA-33523145-1">
  </script>
  <script>
   window.dataLayer = window.dataLayer || [];
  function gtag(){dataLayer.push(arguments);}
  gtag('js', new Date());
  gtag('config', 'UA-33523145-1');
  </script>
  <meta content="NRC Web" name="apple-mobile-web-app-title"/>
  <meta content="NRC Web" name="application-name"/>
  <meta content="#ffffff" name="msapplication-TileColor"/>
  <meta content="#ffffff" name="theme-color"/>
  <meta content="IE=edge" http-equiv="X-UA-Compatible"/>
  <meta content="width=device-width, initial-scale=1.0" name="viewport"/>
  <meta content="279" property="og:image:width"/>
  <meta content="279" property="og:image:height"/>
  <meta content="home" property="og:title"/>
  <meta content="Nuclear Regulatory Commission" property="og:description"/>
  <meta content="/cdn/site/logo/og-image.jpg" property="og:image"/>
  <meta content="https://www.nrc.gov/" property="og:url"/>
  <meta content="NRC Web" property="og:site_name"/>
  <meta content="summary" name="twitter:card"/>
  <meta content="@NRC" name="twitter:creator"/>
  <meta content="@NRCgov" name="twitter:site"/>
  <meta content="website" property="og:type"/>
  <meta content="en-US" property="og:locale"/>
  <meta content="/cdn/site/logo/browserconfig.xml" name="msapplication-config"/>
  <meta content="" name="google-site-verification"/>
  <meta content="" name="msvalidate.01"/>
  <link href="/cdn/site/logo/apple-touch-icon.png" rel="apple-touch-icon" sizes="180x180"/>
  <link href="/cdn/site/logo/favicon.ico" rel="shortcut icon"/>
  <link href="/cdn/site/logo/favicon-32x32.png" rel="icon" sizes="32x32" type="image/png"/>
  <link href="/cdn/site/logo/favicon-16x16.png" rel="icon" sizes="16x16" type="image/png"/>
  <link href="/cdn/site/logo/manifest.json" rel="manifest"/>
  <link color="#ffffff" href="/cdn/site/logo/safari-pinned-tab.svg" rel="mask-icon"/>
  <script src="/cdn/legacy/admin/js/survey/foresee-trigger.js">
  </script>
  <!-- CORE CSS -->
  <link href="/working/nrcweb/bundle.css" rel="stylesheet" type="text/css"/>
  <link href="https://www.nrc.gov/" rel="canonical"/>
  <link href="/CMSPages/GetResource.ashx?_webparts=677" rel="stylesheet" type="text/css"/>
 </head>
 <body class="LTR Unknown ENUS ContentBody">
  <form action="/" id="form" method="post">
   <input id="lng" name="lng" type="hidden" value="en-US"/>
   <script type="text/javascript">
    //<![CDATA[

function PM_Postback(param) { if (window.top.HideScreenLockWarningAndSync) { window.top.HideScreenLockWarningAndSync(1080); } if(window.CMSContentManager) { CMSContentManager.allowSubmit = true; }; __doPostBack('m$am',param); }
function PM_Callback(param, callback, ctx) { if (window.top.HideScreenLockWarningAndSync) { window.top.HideScreenLockWarningAndSync(1080); }if (window.CMSContentManager) { CMSContentManager.storeContentChangedStatus(); };WebForm_DoCallback('m$am',param,callback,ctx,null,true); }
//]]>
   </script>
   <script type="text/javascript">
    //<![CDATA[

var CMS = CMS || {};
CMS.Application = {
  "language": "en",
  "imagesUrl": "/CMSPages/GetResource.ashx?image=%5bImages.zip%5d%2f",
  "isDebuggingEnabled": false,
  "applicationUrl": "/",
  "isDialog": false,
  "isRTL": "false"
};

//]]>
   </script>
   <input id="__VIEWSTATEGENERATOR" name="__VIEWSTATEGENERATOR" type="hidden" value="A5343185"/>
   <div id="ctxM">
   </div>
   <div id="container-wrap">
    <!-- Begin Header -->
    <header>
     <!-- Begin Print Logo -->
     <div class="print-logo">
      <img alt="United States Nuclear Regulatory Commission" src="/cdn/site/logo/logo-nrc-banner-print.jpg"/>
     </div>
     <!-- End Print Logo -->
     <div class="navbar revised">
      <!-- Begin Mobile Logo and Hamburger Icon -->
      <div class="navbar-header">
       <div class="container">
        <!-- Begin Hamburger Icon -->
        <a class="navbar-toggle btn responsive-menu pull-right" data-target=".navbar-collapse" data-toggle="collapse">
         <i class="icon-fontello-menu-1">
         </i>
        </a>
        <!-- End Hamburger Icon -->
        <!-- Begin Top Header -->
        <ul class="info pull-left">
        </ul>
        <ul class="social pull-right hide-menu-for-mobile">
         <li class="header-link">
          <a href="/reading-rm/faqlist.html" id="p_lt_WebPartZone3_zRightHeader_CORE_V1_Header_Link_btnElem_hyperLink" target="_self">
           <span id="p_lt_WebPartZone3_zRightHeader_CORE_V1_Header_Link_btnElem_lblText">
            FAQ
           </span>
          </a>
         </li>
         <li class="header-link">
          <a href="/reading-rm/basic-ref/glossary.html" id="p_lt_WebPartZone3_zRightHeader_CORE_V1_Header_Link1_btnElem_hyperLink" target="_self">
           <span id="p_lt_WebPartZone3_zRightHeader_CORE_V1_Header_Link1_btnElem_lblText">
            Glossary
           </span>
          </a>
         </li>
         <li class="header-link">
          <a href="/info-finder.html" id="p_lt_WebPartZone3_zRightHeader_CORE_V1_Header_Link2_btnElem_hyperLink" target="_self">
           <span id="p_lt_WebPartZone3_zRightHeader_CORE_V1_Header_Link2_btnElem_lblText">
            Facility Locator
           </span>
          </a>
         </li>
         <li class="header-link">
          <a href="/site-help/new-content.html" id="p_lt_WebPartZone3_zRightHeader_CORE_V1_Header_Link3_btnElem_hyperLink" target="_self">
           <span id="p_lt_WebPartZone3_zRightHeader_CORE_V1_Header_Link3_btnElem_lblText">
            What's New
           </span>
          </a>
         </li>
         <li class="header-link">
          <a href="/site-help.html" id="p_lt_WebPartZone3_zRightHeader_CORE_V1_Header_Link4_btnElem_hyperLink" target="_self">
           <span id="p_lt_WebPartZone3_zRightHeader_CORE_V1_Header_Link4_btnElem_lblText">
            Site Help
           </span>
          </a>
         </li>
         <li class="header-link">
          <a href="/site-help/index-az.html" id="p_lt_WebPartZone3_zRightHeader_CORE_V1_Header_Link5_btnElem_hyperLink" target="_self">
           <span id="p_lt_WebPartZone3_zRightHeader_CORE_V1_Header_Link5_btnElem_lblText">
            Index A-Z
           </span>
          </a>
         </li>
         <li class="header-link">
          <a href="/about-nrc/contactus.html" id="p_lt_WebPartZone3_zRightHeader_CORE_V1_Header_Link6_btnElem_hyperLink" target="_self">
           <span id="p_lt_WebPartZone3_zRightHeader_CORE_V1_Header_Link6_btnElem_lblText">
            Contact Us
           </span>
          </a>
         </li>
         <li class="header-link">
          <a href="/public-involve/listserver.html" id="p_lt_WebPartZone3_zRightHeader_CORE_V1_Header_Link7_btnElem_hyperLink" target="_self">
           <span id="p_lt_WebPartZone3_zRightHeader_CORE_V1_Header_Link7_btnElem_lblText">
            Email Updates
           </span>
          </a>
         </li>
        </ul>
        <div style="position: relative;">
         <div class="rs_addtools rs_splitbutton rs_preserve rs_skip" id="xp1" style="z-index: 99; position: absolute; top: 13px; left: 578px;">
         </div>
        </div>
        <!-- End Top Header -->
        <!-- Begin Zone for Mobile Logo -->
        <a class="navbar-brand" href="/">
         <img alt="NRC Web" class="logo" src="/cdn/site/logo/logo.png"/>
        </a>
        <!-- End Zone for Mobile Logo -->
       </div>
      </div>
      <!-- End Mobile Logo and Hamburger Icon -->
      <!-- Begin Main Navigation, Desktop Logo, and Search Dropdown -->
      <div class="yamm">
       <div class="navbar-band with-social">
        <div class="container">
         <div class="row">
          <div class="col-sm-12">
           <!-- Begin Desktop Logo -->
           <div class="pull-left nav-logo">
            <a class="logo" href="/">
             <img alt="NRC Web" class="logo" src="/cdn/site/logo/logo.png"/>
            </a>
           </div>
           <!-- End Desktop Logo -->
           <!-- Begin Search and Other Comp -->
           <div class="pull-right navbar-search inline">
            <span class="btn-widget text-center">
             <a class="btn btn-medium quaternary-background full-width black" href="/about-nrc/regulatory/allegations/safety-concern.html" target="_self">
              Report a Safety Concern
             </a>
            </span>
            <div class="searchBox" id="p_lt_WebPartZone7_zS_SmartSearchBox_pnlSearch">
             <label for="p_lt_WebPartZone7_zS_SmartSearchBox_txtWord" id="p_lt_WebPartZone7_zS_SmartSearchBox_lblSearch" style="display:none;">
              Search for:
             </label>
             <input class="search-box form-control" id="p_lt_WebPartZone7_zS_SmartSearchBox_txtWord" maxlength="1000" name="p$lt$WebPartZone7$zS$SmartSearchBox$txtWord" type="text"/>
             <input class="search-button btn btn-default" id="p_lt_WebPartZone7_zS_SmartSearchBox_btnSearch" name="p$lt$WebPartZone7$zS$SmartSearchBox$btnSearch" type="submit" value="Search"/>
             <div class="predictiveSearchHolder" id="p_lt_WebPartZone7_zS_SmartSearchBox_pnlPredictiveResultsHolder">
             </div>
            </div>
            <ul class="social header hide-menu-for-mobile">
             <!--Facebook-->
             <li class="header-link social">
              <a href="https://www.facebook.com/nrcgov/" target="_blank" title="NRC Facebook">
               <i class="icon-fontello-s-facebook">
               </i>
              </a>
             </li>
             <!--Twitter-->
             <li class="header-link social">
              <a href="https://twitter.com/nrcgov" target="_blank" title="NRC Twitter Feed">
               <i class="icon-fontello-s-twitter">
               </i>
              </a>
             </li>
             <!--Linkedin-->
             <li class="header-link social">
              <a href="https://www.linkedin.com/company/u-s--nuclear-regulatory-commission/" target="_blank" title="NRC Linkedin">
               <i class="icon-fontello-s-linkedin">
               </i>
              </a>
             </li>
             <!--Instagram-->
             <!-- YouTube -->
             <li class="header-link social">
              <a href="https://www.youtube.com/user/NRCgov" target="_blank" title="NRC YouTube Channel">
               <i class="icon-fontello-s-youtube">
               </i>
              </a>
             </li>
             <!--Pinterest-->
             <!--Flickr-->
             <li class="header-link social">
              <a href="https://www.flickr.com/photos/nrcgov/sets" target="_blank" title="NRC Flickr Gallery">
               <i class="icon-fontello-s-flickr">
               </i>
              </a>
             </li>
             <!--Blog-->
             <li class="header-link social">
              <a href="https://public-blog.nrc-gateway.gov/" target="_blank" title="NRC Blog Archived">
               <i class="icon-fontello-pencil">
               </i>
              </a>
             </li>
             <!--Subscribe-->
             <li class="header-link social">
              <a href="https://service.govdelivery.com/service/multi_subscribe.html?code=USNRC" target="_blank" title="NRC Email Subscriptions - GovDelivery">
               <i class="icon-fontello-comment">
               </i>
              </a>
             </li>
             <!--RSS-->
             <li class="header-link social">
              <a href="/public-involve/listserver.html#rss" target="_self" title="NRC RSS Feed">
               <i class="icon-fontello-rss">
               </i>
              </a>
             </li>
            </ul>
            <!-- End Search and Other Comp -->
           </div>
          </div>
         </div>
        </div>
       </div>
       <div class="navbar-collapse collapse">
        <div class="container">
         <!-- Begin Main Navigation -->
         <ul class="nav navbar-nav">
          <li class="dropdown yamm-fullwidth">
           <a class="dropdown-toggle" href="/reactors.html">
            Nuclear Reactors
           </a>
           <a class="angle top-level" data-toggle="dropdown" href="#">
           </a>
           <ul class="dropdown-menu yamm-dropdown-menu">
            <li>
             <div class="yamm-content">
              <div class="container">
               <div class="row inner-top-xs general-content">
                <div class="mb-pd-btm col-sm-4">
                 <a href="/reactors/power.html" id="mm3c1_CORE_V1_InPageLink_btnElem_hyperLink" target="_self">
                  <span id="mm3c1_CORE_V1_InPageLink_btnElem_lblText">
                   Power Reactors
                  </span>
                 </a>
                 <a href="/reactors/non-power.html" id="mm3c1_CORE_V1_InPageLink1_btnElem_hyperLink" target="_self">
                  <span id="mm3c1_CORE_V1_InPageLink1_btnElem_lblText">
                   Research &amp; Test Reactors
                  </span>
                 </a>
                </div>
                <div class="mb-pd-btm col-sm-4">
                 <a href="/reactors/operating.html" id="mm3c2_CORE_V1_InPageLink2_btnElem_hyperLink" target="_self">
                  <span id="mm3c2_CORE_V1_InPageLink2_btnElem_lblText">
                   Operating Reactors
                  </span>
                 </a>
                 <a href="/reactors/new-reactors.html" id="mm3c2_CORE_V1_InPageLink3_btnElem_hyperLink" target="_self">
                  <span id="mm3c2_CORE_V1_InPageLink3_btnElem_lblText">
                   New Reactors
                  </span>
                 </a>
                </div>
                <div class="mb-pd-btm col-sm-4">
                 <a href="/reactors/operator-licensing.html" id="mm3c3_CORE_V1_InPageLink4_btnElem_hyperLink" target="_self">
                  <span id="mm3c3_CORE_V1_InPageLink4_btnElem_lblText">
                   Operator Licensing
                  </span>
                 </a>
                 <a href="/about-nrc/regulatory/research.html" id="mm3c3_CORE_V1_InPageLink5_btnElem_hyperLink" target="_self">
                  <span id="mm3c3_CORE_V1_InPageLink5_btnElem_lblText">
                   Research Activities
                  </span>
                 </a>
                </div>
               </div>
              </div>
              <div class="container">
               <div class="row inner-top-xs general-content">
                <div class="col-md-12">
                 <hr class="line dashed-line-brand-color-yellow"/>
                 <a class="quick-link" href="/reactors/ql-reactors.html" id="mm1c1_CORE_V1_InPageLink6_btnElem_hyperLink" target="_self">
                  <span id="mm1c1_CORE_V1_InPageLink6_btnElem_lblText">
                   Nuclear Reactor Quick Links
                  </span>
                 </a>
                </div>
               </div>
              </div>
             </div>
            </li>
           </ul>
          </li>
          <li class="dropdown yamm-fullwidth">
           <a class="dropdown-toggle" href="/materials.html">
            Nuclear Materials
           </a>
           <a class="angle top-level" data-toggle="dropdown" href="#">
           </a>
           <ul class="dropdown-menu yamm-dropdown-menu">
            <li>
             <div class="yamm-content">
              <div class="container">
               <div class="row inner-top-xs general-content">
                <div class="mb-pd-btm col-sm-4">
                 <a href="/materials/sp-nucmaterials.html" id="mm13c1_CORE_V1_InPageLink_btnElem_hyperLink" target="_self">
                  <span id="mm13c1_CORE_V1_InPageLink_btnElem_lblText">
                   Special Nuclear Material
                  </span>
                 </a>
                 <a href="/materials/srcmaterial.html" id="mm13c1_CORE_V1_InPageLink1_btnElem_hyperLink" target="_self">
                  <span id="mm13c1_CORE_V1_InPageLink1_btnElem_lblText">
                   Source Material
                  </span>
                 </a>
                 <a href="/materials/byproduct-mat.html" id="mm13c1_CORE_V1_InPageLink6_btnElem_hyperLink" target="_self">
                  <span id="mm13c1_CORE_V1_InPageLink6_btnElem_lblText">
                   Byproduct Material
                  </span>
                 </a>
                </div>
                <div class="mb-pd-btm col-sm-4">
                 <a href="/materials/medical.html" id="mm13c2_CORE_V1_InPageLink2_btnElem_hyperLink" target="_self">
                  <span id="mm13c2_CORE_V1_InPageLink2_btnElem_lblText">
                   Med, Ind, &amp; Academic Uses
                  </span>
                 </a>
                 <a href="/materials/radium.html" id="mm13c2_CORE_V1_InPageLink3_btnElem_hyperLink" target="_self">
                  <span id="mm13c2_CORE_V1_InPageLink3_btnElem_lblText">
                   Radium
                  </span>
                 </a>
                 <a href="/materials/uranium-recovery.html" id="mm13c2_CORE_V1_InPageLink7_btnElem_hyperLink" target="_self">
                  <span id="mm13c2_CORE_V1_InPageLink7_btnElem_lblText">
                   Uranium Recovery
                  </span>
                 </a>
                </div>
                <div class="mb-pd-btm col-sm-4">
                 <a href="/materials/fuel-cycle-fac.html" id="mm13c3_CORE_V1_InPageLink4_btnElem_hyperLink" target="_self">
                  <span id="mm13c3_CORE_V1_InPageLink4_btnElem_lblText">
                   Fuel Cycle Facilities
                  </span>
                 </a>
                 <a href="/materials/transportation.html" id="mm13c3_CORE_V1_InPageLink5_btnElem_hyperLink" target="_self">
                  <span id="mm13c3_CORE_V1_InPageLink5_btnElem_lblText">
                   Materials Transportation
                  </span>
                 </a>
                 <a href="/about-nrc/regulatory/research.html" id="mm13c3_CORE_V1_InPageLink8_btnElem_hyperLink" target="_self">
                  <span id="mm13c3_CORE_V1_InPageLink8_btnElem_lblText">
                   Research Activities
                  </span>
                 </a>
                </div>
               </div>
              </div>
              <div class="container">
               <div class="row inner-top-xs general-content">
                <div class="col-md-12">
                 <hr class="line dashed-line-brand-color-yellow"/>
                 <a class="quick-link" href="/materials/ql-materials.html" id="mm11c1_CORE_V1_InPageLink9_btnElem_hyperLink" target="_self">
                  <span id="mm11c1_CORE_V1_InPageLink9_btnElem_lblText">
                   Nuclear Materials Quick Links
                  </span>
                 </a>
                </div>
               </div>
              </div>
             </div>
            </li>
           </ul>
          </li>
          <li class="dropdown yamm-fullwidth">
           <a class="dropdown-toggle" href="/waste.html">
            Radioactive Waste
           </a>
           <a class="angle top-level" data-toggle="dropdown" href="#">
           </a>
           <ul class="dropdown-menu yamm-dropdown-menu">
            <li>
             <div class="yamm-content">
              <div class="container">
               <div class="row inner-top-xs general-content">
                <div class="mb-pd-btm col-sm-4">
                 <a href="/waste/decommissioning.html" id="mm23c1_CORE_V1_InPageLink_btnElem_hyperLink" target="_self">
                  <span id="mm23c1_CORE_V1_InPageLink_btnElem_lblText">
                   Decommissioning of Nuclear Facilities
                  </span>
                 </a>
                 <a href="/waste/low-level-waste.html" id="mm23c1_CORE_V1_InPageLink1_btnElem_hyperLink" target="_self">
                  <span id="mm23c1_CORE_V1_InPageLink1_btnElem_lblText">
                   Low-Level Waste
                  </span>
                 </a>
                 <a href="/waste/incidental-waste.html" id="mm23c1_CORE_V1_InPageLink6_btnElem_hyperLink" target="_self">
                  <span id="mm23c1_CORE_V1_InPageLink6_btnElem_lblText">
                   Waste Incidental to Reprocessing
                  </span>
                 </a>
                 <a href="/waste/high-level-waste.html" id="mm23c1_CORE_V1_InPageLink7_btnElem_hyperLink" target="_self">
                  <span id="mm23c1_CORE_V1_InPageLink7_btnElem_lblText">
                   High-Level Waste
                  </span>
                 </a>
                </div>
                <div class="mb-pd-btm col-sm-4">
                 <a href="/waste/mill-tailings.html" id="mm23c2_CORE_V1_InPageLink2_btnElem_hyperLink" target="_self">
                  <span id="mm23c2_CORE_V1_InPageLink2_btnElem_lblText">
                   Uranium Mill Tailings
                  </span>
                 </a>
                 <a href="/waste/llw-disposal.html" id="mm23c2_CORE_V1_InPageLink3_btnElem_hyperLink" target="_self">
                  <span id="mm23c2_CORE_V1_InPageLink3_btnElem_lblText">
                   Low-Level Waste Disposal
                  </span>
                 </a>
                 <a href="/waste/hlw-disposal.html" id="mm23c2_CORE_V1_InPageLink9_btnElem_hyperLink" target="_self">
                  <span id="mm23c2_CORE_V1_InPageLink9_btnElem_lblText">
                   High-Level Waste Disposal
                  </span>
                 </a>
                </div>
                <div class="mb-pd-btm col-sm-4">
                 <a href="/waste/spent-fuel-storage.html" id="mm23c3_CORE_V1_InPageLink8_btnElem_hyperLink" target="_self">
                  <span id="mm23c3_CORE_V1_InPageLink8_btnElem_lblText">
                   Storage of Spent Nuclear Fuel
                  </span>
                 </a>
                 <a href="/waste/spent-fuel-transp.html" id="mm23c3_CORE_V1_InPageLink4_btnElem_hyperLink" target="_self">
                  <span id="mm23c3_CORE_V1_InPageLink4_btnElem_lblText">
                   Transportation of Spent Nuclear Fuel
                  </span>
                 </a>
                 <a href="/about-nrc/regulatory/research.html" id="mm23c3_CORE_V1_InPageLink5_btnElem_hyperLink" target="_self">
                  <span id="mm23c3_CORE_V1_InPageLink5_btnElem_lblText">
                   Research Activities
                  </span>
                 </a>
                </div>
               </div>
              </div>
              <div class="container">
               <div class="row inner-top-xs general-content">
                <div class="col-md-12">
                 <hr class="line dashed-line-brand-color-yellow"/>
                 <a class="quick-link" href="/waste/ql-waste.html" id="mm21c1_CORE_V1_InPageLink10_btnElem_hyperLink" target="_self">
                  <span id="mm21c1_CORE_V1_InPageLink10_btnElem_lblText">
                   Radioactive Waste Quick Links
                  </span>
                 </a>
                </div>
               </div>
              </div>
             </div>
            </li>
           </ul>
          </li>
          <li class="dropdown yamm-fullwidth">
           <a class="dropdown-toggle" href="/security.html">
            Nuclear Security
           </a>
           <a class="angle top-level" data-toggle="dropdown" href="#">
           </a>
           <ul class="dropdown-menu yamm-dropdown-menu">
            <li>
             <div class="yamm-content">
              <div class="container">
               <div class="row inner-top-xs general-content">
                <div class="mb-pd-btm col-sm-4">
                 <a href="/security/domestic.html" id="mm33c1_CORE_V1_InPageLink_btnElem_hyperLink" target="_self">
                  <span id="mm33c1_CORE_V1_InPageLink_btnElem_lblText">
                   Domestic Safeguards
                  </span>
                 </a>
                 <a href="/security/info-security.html" id="mm33c1_CORE_V1_InPageLink1_btnElem_hyperLink" target="_self">
                  <span id="mm33c1_CORE_V1_InPageLink1_btnElem_lblText">
                   Information Security
                  </span>
                 </a>
                 <a href="/security/byproduct.html" id="mm33c1_CORE_V1_InPageLink6_btnElem_hyperLink" target="_self">
                  <span id="mm33c1_CORE_V1_InPageLink6_btnElem_lblText">
                   Radioactive Material Security
                  </span>
                 </a>
                </div>
                <div class="mb-pd-btm col-sm-4">
                 <a href="/security/required-reporting-for-clearance-holders.html" id="mm33c2_CORE_V1_InPageLink2_btnElem_hyperLink" target="_self">
                  <span id="mm33c2_CORE_V1_InPageLink2_btnElem_lblText">
                   Required Reporting for Clearance Holders
                  </span>
                 </a>
                 <a href="/security/insider-threat-program-for-licensees.html" id="mm33c2_CORE_V1_InPageLink3_btnElem_hyperLink" target="_self">
                  <span id="mm33c2_CORE_V1_InPageLink3_btnElem_lblText">
                   Insider Threat Program for Licensees
                  </span>
                 </a>
                </div>
                <div class="mb-pd-btm col-sm-4">
                 <a href="/security/chp.html" id="mm33c3_CORE_V1_InPageLink4_btnElem_hyperLink" target="_self">
                  <span id="mm33c3_CORE_V1_InPageLink4_btnElem_lblText">
                   Criminal History &amp; Firearms Checks
                  </span>
                 </a>
                 <a href="/security/contactus.html" id="mm33c3_CORE_V1_InPageLink5_btnElem_hyperLink" target="_self">
                  <span id="mm33c3_CORE_V1_InPageLink5_btnElem_lblText">
                   Contact Us
                  </span>
                 </a>
                </div>
               </div>
              </div>
             </div>
            </li>
           </ul>
          </li>
          <li class="dropdown yamm-fullwidth">
           <a class="dropdown-toggle" href="/public-involve.html">
            Public Meetings &amp; Involvement
           </a>
           <a class="angle top-level" data-toggle="dropdown" href="#">
           </a>
           <ul class="dropdown-menu yamm-dropdown-menu">
            <li>
             <div class="yamm-content">
              <div class="container">
               <div class="row inner-top-xs general-content">
                <div class="mb-pd-btm col-sm-4">
                 <a href="/public-involve/open.html" id="mm43c1_CORE_V1_InPageLink_btnElem_hyperLink" target="_self">
                  <span id="mm43c1_CORE_V1_InPageLink_btnElem_lblText">
                   The NRC Approach to Open Government
                  </span>
                 </a>
                 <a href="/public-involve/public-meetings.html" id="mm43c1_CORE_V1_InPageLink1_btnElem_hyperLink" target="_self">
                  <span id="mm43c1_CORE_V1_InPageLink1_btnElem_lblText">
                   About Meetings Open to the Public
                  </span>
                 </a>
                 <a href="/public-involve/conferences.html" id="mm43c1_CORE_V1_InPageLink6_btnElem_hyperLink" target="_self">
                  <span id="mm43c1_CORE_V1_InPageLink6_btnElem_lblText">
                   Conferences &amp; Symposia
                  </span>
                 </a>
                </div>
                <div class="mb-pd-btm col-sm-4">
                 <a href="/public-involve/doc-comment.html" id="mm43c2_CORE_V1_InPageLink7_btnElem_hyperLink" target="_self">
                  <span id="mm43c2_CORE_V1_InPageLink7_btnElem_lblText">
                   Documents for Comment
                  </span>
                 </a>
                 <a href="/about-nrc/regulatory/rulemaking/rules-petitions.html" id="mm43c2_CORE_V1_InPageLink2_btnElem_hyperLink" target="_self">
                  <span id="mm43c2_CORE_V1_InPageLink2_btnElem_lblText">
                   NRC Rules and Petitions
                  </span>
                 </a>
                 <a href="/public-involve/stakeholder-involvement.html" id="mm43c2_CORE_V1_InPageLink3_btnElem_hyperLink" target="_self">
                  <span id="mm43c2_CORE_V1_InPageLink3_btnElem_lblText">
                   Facilitating Stakeholder Involvement
                  </span>
                 </a>
                </div>
                <div class="mb-pd-btm col-sm-4">
                 <a href="/public-involve/info-quality.html" id="mm43c3_CORE_V1_InPageLink8_btnElem_hyperLink" target="_self">
                  <span id="mm43c3_CORE_V1_InPageLink8_btnElem_lblText">
                   NRC Information Quality Guidelines
                  </span>
                 </a>
                 <a href="/public-involve/listserver.html" id="mm43c3_CORE_V1_InPageLink9_btnElem_hyperLink" target="_self">
                  <span id="mm43c3_CORE_V1_InPageLink9_btnElem_lblText">
                   Subscribe to E-mail Updates
                  </span>
                 </a>
                </div>
               </div>
              </div>
              <div class="container">
               <div class="row inner-top-xs general-content">
                <div class="col-md-12">
                 <hr class="line dashed-line-brand-color-yellow"/>
                </div>
               </div>
              </div>
              <div class="container">
               <div class="row inner-top-xs general-content">
                <div class="mb-pd-btm col-md-4">
                 <a class="quick-link" href="/public-involve/public-meetings/schedule.html" id="mm431c1_CORE_V1_InPageLink4_btnElem_hyperLink" target="_self">
                  <span id="mm431c1_CORE_V1_InPageLink4_btnElem_lblText">
                   Commission Schedule
                  </span>
                 </a>
                 <a class="quick-link" href="/pmns/mtg" id="mm431c1_CORE_V1_InPageLink5_btnElem_hyperLink" target="_self">
                  <span id="mm431c1_CORE_V1_InPageLink5_btnElem_lblText">
                   Public Meeting Schedule
                  </span>
                 </a>
                </div>
                <div class="mb-pd-btm col-md-4">
                 <a class="quick-link" href="/about-nrc/regulatory/adjudicatory.html" id="mm431c2_CORE_V1_InPageLink10_btnElem_hyperLink" target="_self">
                  <span id="mm431c2_CORE_V1_InPageLink10_btnElem_lblText">
                   Adjudications (Hearings)
                  </span>
                 </a>
                 <a class="quick-link" href="/site-help/e-submittals/adjudicatory-sub.html" id="mm431c2_CORE_V1_InPageLink11_btnElem_hyperLink" target="_self">
                  <span id="mm431c2_CORE_V1_InPageLink11_btnElem_lblText">
                   Adjudicatory Submissions
                  </span>
                 </a>
                </div>
                <div class="mb-pd-btm col-md-4">
                </div>
               </div>
              </div>
             </div>
            </li>
           </ul>
          </li>
          <li class="dropdown yamm-fullwidth">
           <a class="dropdown-toggle" href="/reading-rm.html">
            NRC Library
           </a>
           <a class="angle top-level" data-toggle="dropdown" href="#">
           </a>
           <ul class="dropdown-menu yamm-dropdown-menu">
            <li>
             <div class="yamm-content">
              <div class="container">
               <div class="row inner-top-xs general-content">
                <div class="mb-pd-btm col-sm-4">
                 <a href="/reading-rm/basic-ref.html" id="mm53c1_CORE_V1_InPageLink_btnElem_hyperLink" target="_self">
                  <span id="mm53c1_CORE_V1_InPageLink_btnElem_lblText">
                   Basic References
                  </span>
                 </a>
                 <a href="/reading-rm/doc-collections/index.html" id="mm53c1_CORE_V1_InPageLink1_btnElem_hyperLink" target="_self">
                  <span id="mm53c1_CORE_V1_InPageLink1_btnElem_lblText">
                   Document Collections
                  </span>
                 </a>
                 <a href="/reading-rm/adams.html" id="mm53c1_CORE_V1_InPageLink6_btnElem_hyperLink" target="_self">
                  <span id="mm53c1_CORE_V1_InPageLink6_btnElem_lblText">
                   ADAMS Public Documents
                  </span>
                 </a>
                 <a href="/reading-rm/pdr.html" id="mm53c1_CORE_V1_InPageLink8_btnElem_hyperLink" target="_self">
                  <span id="mm53c1_CORE_V1_InPageLink8_btnElem_lblText">
                   Public Document Room
                  </span>
                 </a>
                 <a href="/reading-rm/lsn/index.html" id="mm53c1_CORE_V1_InPageLink7_btnElem_hyperLink" target="_self">
                  <span id="mm53c1_CORE_V1_InPageLink7_btnElem_lblText">
                   LSN Library
                  </span>
                 </a>
                </div>
                <div class="mb-pd-btm col-sm-4">
                 <a href="/reading-rm/foia/foia-privacy.html" id="mm53c2_CORE_V1_InPageLink2_btnElem_hyperLink" target="_self">
                  <span id="mm53c2_CORE_V1_InPageLink2_btnElem_lblText">
                   FOIA &amp; Privacy Act
                  </span>
                 </a>
                 <a href="/reading-rm/photo-gallery/index.html" id="mm53c2_CORE_V1_InPageLink3_btnElem_hyperLink" target="_self">
                  <span id="mm53c2_CORE_V1_InPageLink3_btnElem_lblText">
                   Photos &amp; Videos
                  </span>
                 </a>
                 <a href="/reading-rm/records-mgmt.html" id="mm53c2_CORE_V1_InPageLink9_btnElem_hyperLink" target="_self">
                  <span id="mm53c2_CORE_V1_InPageLink9_btnElem_lblText">
                   Records Management
                  </span>
                 </a>
                 <a href="/reading-rm/training.html" id="mm53c2_CORE_V1_InPageLink10_btnElem_hyperLink" target="_self">
                  <span id="mm53c2_CORE_V1_InPageLink10_btnElem_lblText">
                   Training Courses
                  </span>
                 </a>
                </div>
                <div class="mb-pd-btm col-sm-4">
                 <a href="/reading-rm/faqlist.html" id="mm53c3_CORE_V1_InPageLink11_btnElem_hyperLink" target="_self">
                  <span id="mm53c3_CORE_V1_InPageLink11_btnElem_lblText">
                   FAQ Index
                  </span>
                 </a>
                 <a href="/reading-rm/copies-docs.html" id="mm53c3_CORE_V1_InPageLink4_btnElem_hyperLink" target="_self">
                  <span id="mm53c3_CORE_V1_InPageLink4_btnElem_lblText">
                   Get Copies of Documents
                  </span>
                 </a>
                 <a href="/reading-rm/sensitive-info.html" id="mm53c3_CORE_V1_InPageLink5_btnElem_hyperLink" target="_self">
                  <span id="mm53c3_CORE_V1_InPageLink5_btnElem_lblText">
                   Withholding of Sensitive Information
                  </span>
                 </a>
                 <a href="/reading-rm/cui.html" id="mm53c3_CORE_V1_InPageLink12_btnElem_hyperLink" target="_self">
                  <span id="mm53c3_CORE_V1_InPageLink12_btnElem_lblText">
                   Controlled Unclassified Information Program (CUI)
                  </span>
                 </a>
                </div>
               </div>
              </div>
              <div class="container">
               <div class="row inner-top-xs general-content">
                <div class="col-md-12">
                 <hr class="line dashed-line-brand-color-yellow"/>
                 <a class="quick-link" href="/about-nrc/regulatory/adjudicatory.html#ehd" id="mm51c1_CORE_V1_InPageLink13_btnElem_hyperLink" target="_self">
                  <span id="mm51c1_CORE_V1_InPageLink13_btnElem_lblText">
                   Electronic Hearing Docket
                  </span>
                 </a>
                </div>
               </div>
              </div>
             </div>
            </li>
           </ul>
          </li>
          <li class="dropdown yamm-fullwidth">
           <a class="dropdown-toggle" href="/about-nrc.html">
            About NRC
           </a>
           <a class="angle top-level" data-toggle="dropdown" href="#">
           </a>
           <ul class="dropdown-menu yamm-dropdown-menu">
            <li>
             <div class="yamm-content">
              <div class="container">
               <div class="row inner-top-xs general-content">
                <div class="mb-pd-btm col-sm-4">
                 <a href="/about-nrc/organization/commfuncdesc.html" id="mm63c1_CORE_V1_InPageLink_btnElem_hyperLink" target="_self">
                  <span id="mm63c1_CORE_V1_InPageLink_btnElem_lblText">
                   The Commission
                  </span>
                 </a>
                 <a href="/about-nrc/organization.html" id="mm63c1_CORE_V1_InPageLink1_btnElem_hyperLink" target="_self">
                  <span id="mm63c1_CORE_V1_InPageLink1_btnElem_lblText">
                   Organization &amp; Functions
                  </span>
                 </a>
                 <a href="/about-nrc/governing-laws.html" id="mm63c1_CORE_V1_InPageLink6_btnElem_hyperLink" target="_self">
                  <span id="mm63c1_CORE_V1_InPageLink6_btnElem_lblText">
                   Governing Legislation
                  </span>
                 </a>
                 <a href="/about-nrc/plans-performance.html" id="mm63c1_CORE_V1_InPageLink7_btnElem_hyperLink" target="_self">
                  <span id="mm63c1_CORE_V1_InPageLink7_btnElem_lblText">
                   Plans, Budget, &amp; Performance
                  </span>
                 </a>
                 <a href="/about-nrc/locations.html" id="mm63c1_CORE_V1_InPageLink8_btnElem_hyperLink" target="_self">
                  <span id="mm63c1_CORE_V1_InPageLink8_btnElem_lblText">
                   Locations
                  </span>
                 </a>
                 <a href="/about-nrc/history.html" id="mm63c1_CORE_V1_InPageLink9_btnElem_hyperLink" target="_self">
                  <span id="mm63c1_CORE_V1_InPageLink9_btnElem_lblText">
                   History
                  </span>
                 </a>
                 <a href="/about-nrc/values.html" id="mm63c1_CORE_V1_InPageLink10_btnElem_hyperLink" target="_self">
                  <span id="mm63c1_CORE_V1_InPageLink10_btnElem_lblText">
                   Values
                  </span>
                 </a>
                 <a href="/about-nrc/policymaking.html" id="mm63c1_CORE_V1_InPageLink2_btnElem_hyperLink" target="_self">
                  <span id="mm63c1_CORE_V1_InPageLink2_btnElem_lblText">
                   Direction-Setting &amp; Policymaking
                  </span>
                 </a>
                 <a href="/about-nrc/regulatory/research.html" id="mm63c1_CORE_V1_InPageLink3_btnElem_hyperLink" target="_self">
                  <span id="mm63c1_CORE_V1_InPageLink3_btnElem_lblText">
                   Research Activities
                  </span>
                 </a>
                 <a href="/about-nrc/radiation.html" id="mm63c1_CORE_V1_InPageLink11_btnElem_hyperLink" target="_self">
                  <span id="mm63c1_CORE_V1_InPageLink11_btnElem_lblText">
                   Radiation Protection
                  </span>
                 </a>
                </div>
                <div class="mb-pd-btm col-sm-4">
                 <a href="/about-nrc/fire-protection.html" id="mm63c2_CORE_V1_InPageLink12_btnElem_hyperLink" target="_self">
                  <span id="mm63c2_CORE_V1_InPageLink12_btnElem_lblText">
                   Fire Protection
                  </span>
                 </a>
                 <a href="/about-nrc/safety-culture.html" id="mm63c2_CORE_V1_InPageLink13_btnElem_hyperLink" target="_self">
                  <span id="mm63c2_CORE_V1_InPageLink13_btnElem_lblText">
                   Safety Culture
                  </span>
                 </a>
                 <a href="/about-nrc/regulatory.html" id="mm63c2_CORE_V1_InPageLink14_btnElem_hyperLink" target="_self">
                  <span id="mm63c2_CORE_V1_InPageLink14_btnElem_lblText">
                   How We Regulate
                  </span>
                 </a>
                 <a href="/about-nrc/emerg-preparedness.html" id="mm63c2_CORE_V1_InPageLink15_btnElem_hyperLink" target="_self">
                  <span id="mm63c2_CORE_V1_InPageLink15_btnElem_lblText">
                   Emergency Preparedness &amp; Response
                  </span>
                 </a>
                 <a href="/about-nrc/public-affairs.html" id="mm63c2_CORE_V1_InPageLink4_btnElem_hyperLink" target="_self">
                  <span id="mm63c2_CORE_V1_InPageLink4_btnElem_lblText">
                   Public Affairs
                  </span>
                 </a>
                 <a href="/about-nrc/congress-affairs.html" id="mm63c2_CORE_V1_InPageLink5_btnElem_hyperLink" target="_self">
                  <span id="mm63c2_CORE_V1_InPageLink5_btnElem_lblText">
                   Congressional Affairs
                  </span>
                 </a>
                 <a href="/about-nrc/regulatory/enforcement.html" id="mm63c2_CORE_V1_InPageLink16_btnElem_hyperLink" target="_self">
                  <span id="mm63c2_CORE_V1_InPageLink16_btnElem_lblText">
                   Enforcement
                  </span>
                 </a>
                 <a href="/about-nrc/international.html" id="mm63c2_CORE_V1_InPageLink17_btnElem_hyperLink" target="_self">
                  <span id="mm63c2_CORE_V1_InPageLink17_btnElem_lblText">
                   International Programs
                  </span>
                 </a>
                 <a href="/about-nrc/state-tribal.html" id="mm63c2_CORE_V1_InPageLink18_btnElem_hyperLink" target="_self">
                  <span id="mm63c2_CORE_V1_InPageLink18_btnElem_lblText">
                   State &amp; Tribal Programs
                  </span>
                 </a>
                </div>
                <div class="mb-pd-btm col-sm-4">
                 <a href="/about-nrc/alt-dispute-resolution.html" id="mm63c3_CORE_V1_InPageLink19_btnElem_hyperLink" target="_self">
                  <span id="mm63c3_CORE_V1_InPageLink19_btnElem_lblText">
                   Alternative Dispute Resolution Programs
                  </span>
                 </a>
                 <a href="/privacy/index.html" id="mm63c3_CORE_V1_InPageLink20_btnElem_hyperLink" target="_self">
                  <span id="mm63c3_CORE_V1_InPageLink20_btnElem_lblText">
                   Privacy Program
                  </span>
                 </a>
                 <a href="/about-nrc/civil-rights.html" id="mm63c3_CORE_V1_InPageLink21_btnElem_hyperLink" target="_self">
                  <span id="mm63c3_CORE_V1_InPageLink21_btnElem_lblText">
                   Civil Rights
                  </span>
                 </a>
                 <a href="/about-nrc/contactus.html" id="mm63c3_CORE_V1_InPageLink22_btnElem_hyperLink" target="_self">
                  <span id="mm63c3_CORE_V1_InPageLink22_btnElem_lblText">
                   Contact Us
                  </span>
                 </a>
                 <a href="/about-nrc/employment.html" id="mm63c3_CORE_V1_InPageLink23_btnElem_hyperLink" target="_self">
                  <span id="mm63c3_CORE_V1_InPageLink23_btnElem_lblText">
                   Career Opportunities
                  </span>
                 </a>
                 <a href="/about-nrc/contracting.html" id="mm63c3_CORE_V1_InPageLink24_btnElem_hyperLink" target="_self">
                  <span id="mm63c3_CORE_V1_InPageLink24_btnElem_lblText">
                   Contracting Opportunities
                  </span>
                 </a>
                 <a href="/about-nrc/contracting/small-business.html" id="mm63c3_CORE_V1_InPageLink25_btnElem_hyperLink" target="_self">
                  <span id="mm63c3_CORE_V1_InPageLink25_btnElem_lblText">
                   Small Businesses
                  </span>
                 </a>
                 <a href="/about-nrc/grants.html" id="mm63c3_CORE_V1_InPageLink26_btnElem_hyperLink" target="_self">
                  <span id="mm63c3_CORE_V1_InPageLink26_btnElem_lblText">
                   Grant Opportunities
                  </span>
                 </a>
                 <a href="/about-nrc/generic-schedules.html" id="mm63c3_CORE_V1_InPageLink27_btnElem_hyperLink" target="_self">
                  <span id="mm63c3_CORE_V1_InPageLink27_btnElem_lblText">
                   Generic Schedules
                  </span>
                 </a>
                </div>
               </div>
              </div>
             </div>
            </li>
           </ul>
          </li>
          <li class="dropdown yamm-fullwidth show-menu-for-mobile">
           <a class="dropdown-toggle" href="/other-links.html">
            Other Links
           </a>
           <a class="angle top-level" data-toggle="dropdown" href="#">
           </a>
           <ul class="dropdown-menu yamm-dropdown-menu">
            <li>
             <div class="yamm-content">
              <!-- Content -->
              <div class="container inner-top-xs">
               <div class="row">
                <div class="col-sm-12 general-content link-page">
                 <h1 class="title-case">
                  Other Links
                 </h1>
                 <div class="container">
                  <div class="row inner-top-xs general-content">
                   <div class="mb-pd-btm col-sm-4">
                    <a href="/reading-rm/faqlist.html" id="mmm33c1_CORE_V1_InPageLink15_btnElem_hyperLink" target="_self">
                     <span id="mmm33c1_CORE_V1_InPageLink15_btnElem_lblText">
                      FAQ
                     </span>
                    </a>
                    <a href="/reading-rm/basic-ref/glossary.html" id="mmm33c1_CORE_V1_InPageLink16_btnElem_hyperLink" target="_self">
                     <span id="mmm33c1_CORE_V1_InPageLink16_btnElem_lblText">
                      Glossary
                     </span>
                    </a>
                    <a href="/info-finder.html" id="mmm33c1_CORE_V1_InPageLink17_btnElem_hyperLink" target="_self">
                     <span id="mmm33c1_CORE_V1_InPageLink17_btnElem_lblText">
                      Facility Locator
                     </span>
                    </a>
                    <a href="/site-help/new-content.html" id="mmm33c1_CORE_V1_InPageLink18_btnElem_hyperLink" target="_self">
                     <span id="mmm33c1_CORE_V1_InPageLink18_btnElem_lblText">
                      What's New
                     </span>
                    </a>
                   </div>
                   <div class="mb-pd-btm col-sm-4">
                    <a href="/site-help.html" id="mmm33c2_CORE_V1_InPageLink19_btnElem_hyperLink" target="_self">
                     <span id="mmm33c2_CORE_V1_InPageLink19_btnElem_lblText">
                      Site Help
                     </span>
                    </a>
                    <a href="/site-help/index-az.html" id="mmm33c2_CORE_V1_InPageLink20_btnElem_hyperLink" target="_self">
                     <span id="mmm33c2_CORE_V1_InPageLink20_btnElem_lblText">
                      Index A-Z
                     </span>
                    </a>
                    <a href="/about-nrc/contactus.html" id="mmm33c2_CORE_V1_InPageLink21_btnElem_hyperLink" target="_self">
                     <span id="mmm33c2_CORE_V1_InPageLink21_btnElem_lblText">
                      Contact Us
                     </span>
                    </a>
                    <a href="/public-involve/listserver.html" id="mmm33c2_CORE_V1_InPageLink22_btnElem_hyperLink" target="_self">
                     <span id="mmm33c2_CORE_V1_InPageLink22_btnElem_lblText">
                      Email Updates
                     </span>
                    </a>
                   </div>
                   <div class="mb-pd-btm col-sm-4">
                    <a href="https://www.facebook.com/nrcgov/" id="mmm33c3_CORE_V1_InPageLink23_btnElem_hyperLink" target="_blank">
                     <span id="mmm33c3_CORE_V1_InPageLink23_btnElem_lblText">
                      NRC Facebook
                     </span>
                    </a>
                    <a href="https://www.twitter.com/nrcgov" id="mmm33c3_CORE_V1_InPageLink24_btnElem_hyperLink" target="_blank">
                     <span id="mmm33c3_CORE_V1_InPageLink24_btnElem_lblText">
                      NRC Twitter Feed
                     </span>
                    </a>
                    <a href="https://www.linkedin.com/company/u-s--nuclear-regulatory-commission/" id="mmm33c3_CORE_V1_InPageLink25_btnElem_hyperLink" target="_blank">
                     <span id="mmm33c3_CORE_V1_InPageLink25_btnElem_lblText">
                      NRC Linkedin
                     </span>
                    </a>
                    <a href="https://www.youtube.com/user/NRCgov" id="mmm33c3_CORE_V1_InPageLink26_btnElem_hyperLink" target="_blank">
                     <span id="mmm33c3_CORE_V1_InPageLink26_btnElem_lblText">
                      NRC Youtube Channel
                     </span>
                    </a>
                    <a href="https://www.flickr.com/photos/nrcgov/sets" id="mmm33c3_CORE_V1_InPageLink27_btnElem_hyperLink" target="_blank">
                     <span id="mmm33c3_CORE_V1_InPageLink27_btnElem_lblText">
                      NRC Flickr Gallery
                     </span>
                    </a>
                    <a href="https://public-blog.nrc-gateway.gov/" id="mmm33c3_CORE_V1_InPageLink28_btnElem_hyperLink" target="_blank">
                     <span id="mmm33c3_CORE_V1_InPageLink28_btnElem_lblText">
                      NRC Blog Archived
                     </span>
                    </a>
                    <a href="https://service.govdelivery.com/service/multi_subscribe.html?code=USNRC" id="mmm33c3_CORE_V1_InPageLink29_btnElem_hyperLink" target="_blank">
                     <span id="mmm33c3_CORE_V1_InPageLink29_btnElem_lblText">
                      NRC Email Subscriptions - GovDelivery
                     </span>
                    </a>
                   </div>
                  </div>
                 </div>
                </div>
               </div>
              </div>
             </div>
            </li>
           </ul>
          </li>
         </ul>
         <!-- End Main Navigation -->
        </div>
       </div>
      </div>
      <!-- End Main Navigation, Desktop Logo, and Search Dropdown -->
     </div>
    </header>
    <!-- End Header -->
    <!-- Begin Content -->
    <main>
     <section class="content-width-hero-slider primary-background height-sm" id="hero">
      <div class="container">
       <div class="owl-carousel height-sm owl-inner-nav owl-ui-lg" id="owl-main">
        <div class="item heroBackground-59 dark-bg img-bg img-bg-soft">
         <span aria-label="the words:'Protecting People and the Environment' on a winter-colored blue contrast background, over a sillouette image of a city park with tall buildings in the background, trees, birds in the sky, and people wearing winter weather clothing, shown participating in activities, i.e., a couple viewing the tall buildings, parent and kid walking, and mother with a stroller etc." role="img">
         </span>
         <style type="text/css">
          .heroBackground-59 {
      background: url(/cdn/legacy/images/homepage/winter-season-hero-mobile.jpg);
      background-repeat: no-repeat !important;
    }
    
    @media only screen and (min-width: 62.5em) {
      .heroBackground-59 {
        background: url(/cdn/legacy/images/homepage/winter-season-hero.jpg);
      }
    }
         </style>
         <div class="container">
          <div class="caption vertical-center text-center">
           <h1 class="fadeInDown-1 white">
            PROTECTING PEOPLE AND THE ENVIRONMENT
           </h1>
           <div class="fadeInDown-3">
            <a class="btn btn-medium primary-background" href="/about-nrc/radiation/protects-you.html#142873">
             Learn More
            </a>
           </div>
          </div>
         </div>
        </div>
        <div class="item heroBackground-73 dark-bg img-bg img-bg-soft">
         <span aria-label="Region III Materials Inspector Ryan Craffey conducts a real-time virtual inspection, observing a licensees readiness to safely perform a well-logging job using equipment containing sealed radioactive sources." role="img">
         </span>
         <style type="text/css">
          .heroBackground-73 {
      background: url(/cdn/legacy/images/homepage/homepage-20210318-mobile.jpg);
      background-repeat: no-repeat !important;
    }
    
    @media only screen and (min-width: 62.5em) {
      .heroBackground-73 {
        background: url(/cdn/legacy/images/homepage/homepage-20210318.jpg);
      }
    }
         </style>
         <div class="container">
          <div class="caption vertical-center text-center">
           <h1 class="fadeInDown-1 black">
           </h1>
           <div class="fadeInDown-3">
            <a class="btn btn-medium primary-background" href="/homepage/features.html#143333">
             Learn More
            </a>
           </div>
          </div>
         </div>
        </div>
        <div class="item heroBackground-72 dark-bg img-bg img-bg-soft">
         <span aria-label="
NRC Region I Materials Inspectors Michael Reichard and Laurie Kauffman conduct a periodic inspection on portable nuclear gauges at a license-holder facility in Glastonbury, Conn. " role="img">
         </span>
         <style type="text/css">
          .heroBackground-72 {
      background: url(/cdn/legacy/images/homepage/homepage-03162021-mobile.jpg);
      background-repeat: no-repeat !important;
    }
    
    @media only screen and (min-width: 62.5em) {
      .heroBackground-72 {
        background: url(/cdn/legacy/images/homepage/homepage-03162021.jpg);
      }
    }
         </style>
         <div class="container">
          <div class="caption vertical-center text-center">
           <h1 class="fadeInDown-1 black">
           </h1>
           <div class="fadeInDown-3">
            <a class="btn btn-medium primary-background" href="/homepage/features.html#143319">
             Learn More
            </a>
           </div>
          </div>
         </div>
        </div>
        <div class="item heroBackground-68 dark-bg img-bg img-bg-soft">
         <span aria-label="NRC Chairman Christopher T. Hanson delivers remarks during the opening session of the NRC 2021 Virtual Regulatory Information Conference" role="img">
         </span>
         <style type="text/css">
          .heroBackground-68 {
      background: url(/cdn/legacy/images/homepage/homepage-20210308-mobile.jpg);
      background-repeat: no-repeat !important;
    }
    
    @media only screen and (min-width: 62.5em) {
      .heroBackground-68 {
        background: url(/cdn/legacy/images/homepage/homepage-20210308.jpg);
      }
    }
         </style>
         <div class="container">
          <div class="caption vertical-center text-center">
           <h1 class="fadeInDown-1 black">
           </h1>
           <div class="fadeInDown-3">
            <a class="btn btn-medium primary-background" href="/homepage/features.html#143269">
             Learn More
            </a>
           </div>
          </div>
         </div>
        </div>
        <div class="item heroBackground-70 dark-bg img-bg img-bg-soft">
         <span aria-label="Commissioner Jeff Baran practices his plenary remarks for the upcoming NRC Regulatory Information Conference and assists in testing the technology needed for the virtual conference." role="img">
         </span>
         <style type="text/css">
          .heroBackground-70 {
      background: url(/cdn/legacy/images/homepage/homepage-03052021-mobile.jpg);
      background-repeat: no-repeat !important;
    }
    
    @media only screen and (min-width: 62.5em) {
      .heroBackground-70 {
        background: url(/cdn/legacy/images/homepage/homepage-03052021.jpg);
      }
    }
         </style>
         <div class="container">
          <div class="caption vertical-center text-center">
           <h1 class="fadeInDown-1 black">
           </h1>
           <div class="fadeInDown-3">
            <a class="btn btn-medium primary-background" href="/homepage/features.html#143307">
             Learn More
            </a>
           </div>
          </div>
         </div>
        </div>
        <div class="item heroBackground-71 dark-bg img-bg img-bg-soft">
         <span aria-label="NRC Commissioner David Wright delivers his 2021 Regulatory Information Conference remarks virtually from his home is South Carolina. " role="img">
         </span>
         <style type="text/css">
          .heroBackground-71 {
      background: url(/cdn/legacy/images/homepage/homepage-20210310-mobile.jpg);
      background-repeat: no-repeat !important;
    }
    
    @media only screen and (min-width: 62.5em) {
      .heroBackground-71 {
        background: url(/cdn/legacy/images/homepage/homepage-20210310.jpg);
      }
    }
         </style>
         <div class="container">
          <div class="caption vertical-center text-center">
           <h1 class="fadeInDown-1 black">
           </h1>
           <div class="fadeInDown-3">
            <a class="btn btn-medium primary-background" href="/homepage/features.html#143313">
             Learn More
            </a>
           </div>
          </div>
         </div>
        </div>
        <div class="item heroBackground-56 dark-bg img-bg img-bg-soft">
         <span aria-label="NRC Infographics - NRC by the numbers March 2021" role="img">
         </span>
         <style type="text/css">
          .heroBackground-56 {
      background: url(/cdn/legacy/images/homepage/homepage-03032021-infographic-mobile.jpg);
      background-repeat: no-repeat !important;
    }
    
    @media only screen and (min-width: 62.5em) {
      .heroBackground-56 {
        background: url(/cdn/legacy/images/homepage/homepage-03032021-infographic.jpg);
      }
    }
         </style>
         <div class="container">
          <div class="caption vertical-center text-center">
           <h1 class="fadeInDown-1 black">
           </h1>
           <div class="fadeInDown-3">
            <a class="btn btn-medium primary-background" href="https://www.flickr.com/photos/nrcgov/50999942127/in/dateposted/#142857">
             Learn More
            </a>
           </div>
          </div>
         </div>
        </div>
       </div>
      </div>
     </section>
     <div class="container inner-top-xs">
      <div class="row">
       <div class="col-md-4">
        <h3 class="text-left white primary-background-heading">
         Spotlight
        </h3>
        <div class="sidenav list home">
         <ul>
          <li>
           <a href="/about-nrc/covid-19/index.html" target="_self">
            NRC COVID-19 Update
           </a>
          </li>
          <li>
           <a href="/employee-info.html" target="_self">
            For Employees
           </a>
          </li>
          <li>
           <a href="/about-nrc/plans-performance/modern-risk-informed-reg.html" target="_self">
            Transformation at the NRC - Updated
           </a>
          </li>
          <li>
           <a href="/public-involve/conference-symposia/ric/index.html" target="_self">
            RIC 2021
           </a>
          </li>
          <li>
           <a href="/insp-gen/oighotline.html" target="_self">
            OIG Hotline
           </a>
          </li>
          <li>
           <a href="/reading-rm/doc-collections/rulemaking-ruleforum/active/ruleindex.html" target="_self">
            Rulemaking Activity
           </a>
          </li>
          <li>
           <a href="/reactors/new-reactors/col-holder/vog/vogtle-readiness-group.html" target="_self">
            New Reactor Construction - Vogtle
           </a>
          </li>
          <li>
           <a href="/reactors/atf.html" target="_self">
            Accident Tolerant Fuel
           </a>
          </li>
          <li>
           <a href="/reading-rm/doc-collections/commission/recent/index.html" target="_self">
            Commission Documents
           </a>
          </li>
          <li>
           <a href="/reactors/new-reactors/advanced.html" target="_self">
            Advanced Reactors
           </a>
          </li>
          <li>
           <a href="/security.html" target="_self">
            Nuclear Security
           </a>
          </li>
          <li>
           <a href="/about-nrc/safety-culture/sc-policy-statement.html" target="_self">
            NRC Safety Culture Policy Statement
           </a>
          </li>
          <li>
           <a href="/reading-rm/doc-collections/nuregs/staff/sr1614/index.html" target="_self">
            Strategic Plan
           </a>
          </li>
         </ul>
        </div>
        <div class="more" style="margin-bottom: 10px ;margin-top:-15px; text-align: center;">
         <a href="/past-key-topics.html">
          Spotlight Archive 
         </a>
        </div>
       </div>
       <div class="col-md-4">
        <h3 class="text-left white primary-background-heading">
         Latest News
        </h3>
        <div class="articles">
         <div class="articles-list">
          <a href="/reading-rm/doc-collections/news/2021/21-003-iv.pdf" target="_blank">
           <i class="icon-fontello-doc-1">
           </i>
           <span>
            NRC to Hold Virtual Meeting to Discuss 2020 Performance of Grand Gulf Nuclear Power Plant
           </span>
          </a>
         </div>
         <div class="articles-list">
          <a href="/reading-rm/doc-collections/news/2021/21-015.pdf" target="_blank">
           <i class="icon-fontello-doc-1">
           </i>
           <span>
            NRC Revises Policy on Enhancing Participation in Public Meetings
           </span>
          </a>
         </div>
         <div class="articles-list">
          <a href="/reading-rm/doc-collections/news/2021/21-014.pdf" target="_blank">
           <i class="icon-fontello-doc-1">
           </i>
           <span>
            NRC Names Andrea Veil Director of the Office of Nuclear Reactor Regulation
           </span>
          </a>
         </div>
         <div class="articles-list">
          <a href="/reading-rm/doc-collections/news/2021/21-003-i.pdf" target="_blank">
           <i class="icon-fontello-doc-1">
           </i>
           <span>
            NRC to Meet with Connecticut Nuclear Energy Advisory Council to Discuss Millstone Nuclear Power Plant Performance
           </span>
          </a>
         </div>
         <div class="articles-list">
          <a href="/reading-rm/doc-collections/news/2021/21-004-iii.pdf" target="_blank">
           <i class="icon-fontello-doc-1">
           </i>
           <span>
            NRC Names New Senior Resident Inspector at Prairie Island Nuclear Power Plant
           </span>
          </a>
         </div>
         <div class="articles-list">
          <a href="/reading-rm/doc-collections/news/2021/21-013.pdf" target="_blank">
           <i class="icon-fontello-doc-1">
           </i>
           <span>
            NRC Issues Annual Assessments for Nation's Nuclear Plants
           </span>
          </a>
         </div>
         <div class="articles-list-button">
          <a class="btn" href="/reading-rm/doc-collections/news/2021/index.html">
           View All
          </a>
         </div>
        </div>
       </div>
       <div class="col-md-4">
        <h3 class="text-left white primary-background-heading">
         Public Meetings
        </h3>
        <div class="text-center">
         <div align="left" style="border:thin solid;">
          <i class="icon-fontello-signal" style="float: left;font-size: 1.75em;">
          </i>
          <p style="overflow: hidden;margin-bottom: 5px !important;">
           <a href="https://video.nrc.gov/" target="_blank">
            Next Commision Webcast
           </a>
           <br/>
           <strong>
            [April 13, 2021 at 9:00 a.m.]
           </strong>
          </p>
         </div>
        </div>
        <div class="pmc" id="calendar">
        </div>
        <script type="text/javascript">
         var calendardata = {
    editable: false,
    eventLimit: true, 
    events: [
  {
title: 'View',
url: 'https://www.nrc.gov/pmns/mtg?do=search.results&pageno=1&StartDate=12/22/2020&EndDate=12/22/2020',
start: '2020-12-22'
},{
title: 'View',
url: 'https://www.nrc.gov/pmns/mtg?do=search.results&pageno=1&StartDate=12/23/2020&EndDate=12/23/2020',
start: '2020-12-23'
},{
title: 'View',
url: 'https://www.nrc.gov/pmns/mtg?do=search.results&pageno=1&StartDate=12/24/2020&EndDate=12/24/2020',
start: '2020-12-24'
},{
title: 'View',
url: 'https://www.nrc.gov/pmns/mtg?do=search.results&pageno=1&StartDate=12/25/2020&EndDate=12/25/2020',
start: '2020-12-25'
},{
title: 'View',
url: 'https://www.nrc.gov/pmns/mtg?do=search.results&pageno=1&StartDate=12/26/2020&EndDate=12/26/2020',
start: '2020-12-26'
},{
title: 'View',
url: 'https://www.nrc.gov/pmns/mtg?do=search.results&pageno=1&StartDate=12/27/2020&EndDate=12/27/2020',
start: '2020-12-27'
},{
title: 'View',
url: 'https://www.nrc.gov/pmns/mtg?do=search.results&pageno=1&StartDate=12/28/2020&EndDate=12/28/2020',
start: '2020-12-28'
},{
title: 'View',
url: 'https://www.nrc.gov/pmns/mtg?do=search.results&pageno=1&StartDate=12/29/2020&EndDate=12/29/2020',
start: '2020-12-29'
},{
title: 'View',
url: 'https://www.nrc.gov/pmns/mtg?do=search.results&pageno=1&StartDate=12/30/2020&EndDate=12/30/2020',
start: '2020-12-30'
},{
title: 'View',
url: 'https://www.nrc.gov/pmns/mtg?do=search.results&pageno=1&StartDate=12/31/2020&EndDate=12/31/2020',
start: '2020-12-31'
},{
title: 'View',
url: 'https://www.nrc.gov/pmns/mtg?do=search.results&pageno=1&StartDate=1/01/2021&EndDate=1/01/2021',
start: '2021-01-01'
},{
title: 'View',
url: 'https://www.nrc.gov/pmns/mtg?do=search.results&pageno=1&StartDate=1/02/2021&EndDate=1/02/2021',
start: '2021-01-02'
},{
title: 'View',
url: 'https://www.nrc.gov/pmns/mtg?do=search.results&pageno=1&StartDate=1/03/2021&EndDate=1/03/2021',
start: '2021-01-03'
},{
title: 'View',
url: 'https://www.nrc.gov/pmns/mtg?do=search.results&pageno=1&StartDate=1/04/2021&EndDate=1/04/2021',
start: '2021-01-04'
},{
title: 'View',
url: 'https://www.nrc.gov/pmns/mtg?do=search.results&pageno=1&StartDate=1/05/2021&EndDate=1/05/2021',
start: '2021-01-05'
},{
title: 'View',
url: 'https://www.nrc.gov/pmns/mtg?do=search.results&pageno=1&StartDate=1/06/2021&EndDate=1/06/2021',
start: '2021-01-06'
},{
title: 'View',
url: 'https://www.nrc.gov/pmns/mtg?do=search.results&pageno=1&StartDate=1/07/2021&EndDate=1/07/2021',
start: '2021-01-07'
},{
title: 'View',
url: 'https://www.nrc.gov/pmns/mtg?do=search.results&pageno=1&StartDate=1/08/2021&EndDate=1/08/2021',
start: '2021-01-08'
},{
title: 'View',
url: 'https://www.nrc.gov/pmns/mtg?do=search.results&pageno=1&StartDate=1/09/2021&EndDate=1/09/2021',
start: '2021-01-09'
},{
title: 'View',
url: 'https://www.nrc.gov/pmns/mtg?do=search.results&pageno=1&StartDate=1/10/2021&EndDate=1/10/2021',
start: '2021-01-10'
},{
title: 'View',
url: 'https://www.nrc.gov/pmns/mtg?do=search.results&pageno=1&StartDate=1/11/2021&EndDate=1/11/2021',
start: '2021-01-11'
},{
title: 'View',
url: 'https://www.nrc.gov/pmns/mtg?do=search.results&pageno=1&StartDate=1/12/2021&EndDate=1/12/2021',
start: '2021-01-12'
},{
title: 'View',
url: 'https://www.nrc.gov/pmns/mtg?do=search.results&pageno=1&StartDate=1/13/2021&EndDate=1/13/2021',
start: '2021-01-13'
},{
title: 'View',
url: 'https://www.nrc.gov/pmns/mtg?do=search.results&pageno=1&StartDate=1/14/2021&EndDate=1/14/2021',
start: '2021-01-14'
},{
title: 'View',
url: 'https://www.nrc.gov/pmns/mtg?do=search.results&pageno=1&StartDate=1/15/2021&EndDate=1/15/2021',
start: '2021-01-15'
},{
title: 'View',
url: 'https://www.nrc.gov/pmns/mtg?do=search.results&pageno=1&StartDate=1/16/2021&EndDate=1/16/2021',
start: '2021-01-16'
},{
title: 'View',
url: 'https://www.nrc.gov/pmns/mtg?do=search.results&pageno=1&StartDate=1/17/2021&EndDate=1/17/2021',
start: '2021-01-17'
},{
title: 'View',
url: 'https://www.nrc.gov/pmns/mtg?do=search.results&pageno=1&StartDate=1/18/2021&EndDate=1/18/2021',
start: '2021-01-18'
},{
title: 'View',
url: 'https://www.nrc.gov/pmns/mtg?do=search.results&pageno=1&StartDate=1/19/2021&EndDate=1/19/2021',
start: '2021-01-19'
},{
title: 'View',
url: 'https://www.nrc.gov/pmns/mtg?do=search.results&pageno=1&StartDate=1/20/2021&EndDate=1/20/2021',
start: '2021-01-20'
},{
title: 'View',
url: 'https://www.nrc.gov/pmns/mtg?do=search.results&pageno=1&StartDate=1/21/2021&EndDate=1/21/2021',
start: '2021-01-21'
},{
title: 'View',
url: 'https://www.nrc.gov/pmns/mtg?do=search.results&pageno=1&StartDate=1/22/2021&EndDate=1/22/2021',
start: '2021-01-22'
},{
title: 'View',
url: 'https://www.nrc.gov/pmns/mtg?do=search.results&pageno=1&StartDate=1/23/2021&EndDate=1/23/2021',
start: '2021-01-23'
},{
title: 'View',
url: 'https://www.nrc.gov/pmns/mtg?do=search.results&pageno=1&StartDate=1/24/2021&EndDate=1/24/2021',
start: '2021-01-24'
},{
title: 'View',
url: 'https://www.nrc.gov/pmns/mtg?do=search.results&pageno=1&StartDate=1/25/2021&EndDate=1/25/2021',
start: '2021-01-25'
},{
title: 'View',
url: 'https://www.nrc.gov/pmns/mtg?do=search.results&pageno=1&StartDate=1/26/2021&EndDate=1/26/2021',
start: '2021-01-26'
},{
title: 'View',
url: 'https://www.nrc.gov/pmns/mtg?do=search.results&pageno=1&StartDate=1/27/2021&EndDate=1/27/2021',
start: '2021-01-27'
},{
title: 'View',
url: 'https://www.nrc.gov/pmns/mtg?do=search.results&pageno=1&StartDate=1/28/2021&EndDate=1/28/2021',
start: '2021-01-28'
},{
title: 'View',
url: 'https://www.nrc.gov/pmns/mtg?do=search.results&pageno=1&StartDate=1/29/2021&EndDate=1/29/2021',
start: '2021-01-29'
},{
title: 'View',
url: 'https://www.nrc.gov/pmns/mtg?do=search.results&pageno=1&StartDate=1/30/2021&EndDate=1/30/2021',
start: '2021-01-30'
},{
title: 'View',
url: 'https://www.nrc.gov/pmns/mtg?do=search.results&pageno=1&StartDate=1/31/2021&EndDate=1/31/2021',
start: '2021-01-31'
},{
title: 'View',
url: 'https://www.nrc.gov/pmns/mtg?do=search.results&pageno=1&StartDate=2/01/2021&EndDate=2/01/2021',
start: '2021-02-01'
},{
title: 'View',
url: 'https://www.nrc.gov/pmns/mtg?do=search.results&pageno=1&StartDate=2/02/2021&EndDate=2/02/2021',
start: '2021-02-02'
},{
title: 'View',
url: 'https://www.nrc.gov/pmns/mtg?do=search.results&pageno=1&StartDate=2/03/2021&EndDate=2/03/2021',
start: '2021-02-03'
},{
title: 'View',
url: 'https://www.nrc.gov/pmns/mtg?do=search.results&pageno=1&StartDate=2/04/2021&EndDate=2/04/2021',
start: '2021-02-04'
},{
title: 'View',
url: 'https://www.nrc.gov/pmns/mtg?do=search.results&pageno=1&StartDate=2/05/2021&EndDate=2/05/2021',
start: '2021-02-05'
},{
title: 'View',
url: 'https://www.nrc.gov/pmns/mtg?do=search.results&pageno=1&StartDate=2/06/2021&EndDate=2/06/2021',
start: '2021-02-06'
},{
title: 'View',
url: 'https://www.nrc.gov/pmns/mtg?do=search.results&pageno=1&StartDate=2/07/2021&EndDate=2/07/2021',
start: '2021-02-07'
},{
title: 'View',
url: 'https://www.nrc.gov/pmns/mtg?do=search.results&pageno=1&StartDate=2/08/2021&EndDate=2/08/2021',
start: '2021-02-08'
},{
title: 'View',
url: 'https://www.nrc.gov/pmns/mtg?do=search.results&pageno=1&StartDate=2/09/2021&EndDate=2/09/2021',
start: '2021-02-09'
},{
title: 'View',
url: 'https://www.nrc.gov/pmns/mtg?do=search.results&pageno=1&StartDate=2/10/2021&EndDate=2/10/2021',
start: '2021-02-10'
},{
title: 'View',
url: 'https://www.nrc.gov/pmns/mtg?do=search.results&pageno=1&StartDate=2/11/2021&EndDate=2/11/2021',
start: '2021-02-11'
},{
title: 'View',
url: 'https://www.nrc.gov/pmns/mtg?do=search.results&pageno=1&StartDate=2/12/2021&EndDate=2/12/2021',
start: '2021-02-12'
},{
title: 'View',
url: 'https://www.nrc.gov/pmns/mtg?do=search.results&pageno=1&StartDate=2/13/2021&EndDate=2/13/2021',
start: '2021-02-13'
},{
title: 'View',
url: 'https://www.nrc.gov/pmns/mtg?do=search.results&pageno=1&StartDate=2/14/2021&EndDate=2/14/2021',
start: '2021-02-14'
},{
title: 'View',
url: 'https://www.nrc.gov/pmns/mtg?do=search.results&pageno=1&StartDate=2/15/2021&EndDate=2/15/2021',
start: '2021-02-15'
},{
title: 'View',
url: 'https://www.nrc.gov/pmns/mtg?do=search.results&pageno=1&StartDate=2/16/2021&EndDate=2/16/2021',
start: '2021-02-16'
},{
title: 'View',
url: 'https://www.nrc.gov/pmns/mtg?do=search.results&pageno=1&StartDate=2/17/2021&EndDate=2/17/2021',
start: '2021-02-17'
},{
title: 'View',
url: 'https://www.nrc.gov/pmns/mtg?do=search.results&pageno=1&StartDate=2/18/2021&EndDate=2/18/2021',
start: '2021-02-18'
},{
title: 'View',
url: 'https://www.nrc.gov/pmns/mtg?do=search.results&pageno=1&StartDate=2/19/2021&EndDate=2/19/2021',
start: '2021-02-19'
},{
title: 'View',
url: 'https://www.nrc.gov/pmns/mtg?do=search.results&pageno=1&StartDate=2/20/2021&EndDate=2/20/2021',
start: '2021-02-20'
},{
title: 'View',
url: 'https://www.nrc.gov/pmns/mtg?do=search.results&pageno=1&StartDate=2/21/2021&EndDate=2/21/2021',
start: '2021-02-21'
},{
title: 'View',
url: 'https://www.nrc.gov/pmns/mtg?do=search.results&pageno=1&StartDate=2/22/2021&EndDate=2/22/2021',
start: '2021-02-22'
},{
title: 'View',
url: 'https://www.nrc.gov/pmns/mtg?do=search.results&pageno=1&StartDate=2/23/2021&EndDate=2/23/2021',
start: '2021-02-23'
},{
title: 'View',
url: 'https://www.nrc.gov/pmns/mtg?do=search.results&pageno=1&StartDate=2/24/2021&EndDate=2/24/2021',
start: '2021-02-24'
},{
title: 'View',
url: 'https://www.nrc.gov/pmns/mtg?do=search.results&pageno=1&StartDate=2/25/2021&EndDate=2/25/2021',
start: '2021-02-25'
},{
title: 'View',
url: 'https://www.nrc.gov/pmns/mtg?do=search.results&pageno=1&StartDate=2/26/2021&EndDate=2/26/2021',
start: '2021-02-26'
},{
title: 'View',
url: 'https://www.nrc.gov/pmns/mtg?do=search.results&pageno=1&StartDate=2/27/2021&EndDate=2/27/2021',
start: '2021-02-27'
},{
title: 'View',
url: 'https://www.nrc.gov/pmns/mtg?do=search.results&pageno=1&StartDate=2/28/2021&EndDate=2/28/2021',
start: '2021-02-28'
},{
title: 'View',
url: 'https://www.nrc.gov/pmns/mtg?do=search.results&pageno=1&StartDate=3/01/2021&EndDate=3/01/2021',
start: '2021-03-01'
},{
title: 'View',
url: 'https://www.nrc.gov/pmns/mtg?do=search.results&pageno=1&StartDate=3/02/2021&EndDate=3/02/2021',
start: '2021-03-02'
},{
title: 'View',
url: 'https://www.nrc.gov/pmns/mtg?do=search.results&pageno=1&StartDate=3/03/2021&EndDate=3/03/2021',
start: '2021-03-03'
},{
title: 'View',
url: 'https://www.nrc.gov/pmns/mtg?do=search.results&pageno=1&StartDate=3/04/2021&EndDate=3/04/2021',
start: '2021-03-04'
},{
title: 'View',
url: 'https://www.nrc.gov/pmns/mtg?do=search.results&pageno=1&StartDate=3/05/2021&EndDate=3/05/2021',
start: '2021-03-05'
},{
title: 'View',
url: 'https://www.nrc.gov/pmns/mtg?do=search.results&pageno=1&StartDate=3/06/2021&EndDate=3/06/2021',
start: '2021-03-06'
},{
title: 'View',
url: 'https://www.nrc.gov/pmns/mtg?do=search.results&pageno=1&StartDate=3/07/2021&EndDate=3/07/2021',
start: '2021-03-07'
},{
title: 'View',
url: 'https://www.nrc.gov/pmns/mtg?do=search.results&pageno=1&StartDate=3/08/2021&EndDate=3/08/2021',
start: '2021-03-08'
},{
title: 'View',
url: 'https://www.nrc.gov/pmns/mtg?do=search.results&pageno=1&StartDate=3/09/2021&EndDate=3/09/2021',
start: '2021-03-09'
},{
title: 'View',
url: 'https://www.nrc.gov/pmns/mtg?do=search.results&pageno=1&StartDate=3/10/2021&EndDate=3/10/2021',
start: '2021-03-10'
},{
title: 'View',
url: 'https://www.nrc.gov/pmns/mtg?do=search.results&pageno=1&StartDate=3/11/2021&EndDate=3/11/2021',
start: '2021-03-11'
},{
title: 'View',
url: 'https://www.nrc.gov/pmns/mtg?do=search.results&pageno=1&StartDate=3/12/2021&EndDate=3/12/2021',
start: '2021-03-12'
},{
title: 'View',
url: 'https://www.nrc.gov/pmns/mtg?do=search.results&pageno=1&StartDate=3/13/2021&EndDate=3/13/2021',
start: '2021-03-13'
},{
title: 'View',
url: 'https://www.nrc.gov/pmns/mtg?do=search.results&pageno=1&StartDate=3/14/2021&EndDate=3/14/2021',
start: '2021-03-14'
},{
title: 'View',
url: 'https://www.nrc.gov/pmns/mtg?do=search.results&pageno=1&StartDate=3/15/2021&EndDate=3/15/2021',
start: '2021-03-15'
},{
title: 'View',
url: 'https://www.nrc.gov/pmns/mtg?do=search.results&pageno=1&StartDate=3/16/2021&EndDate=3/16/2021',
start: '2021-03-16'
},{
title: 'View',
url: 'https://www.nrc.gov/pmns/mtg?do=search.results&pageno=1&StartDate=3/17/2021&EndDate=3/17/2021',
start: '2021-03-17'
},{
title: 'View',
url: 'https://www.nrc.gov/pmns/mtg?do=search.results&pageno=1&StartDate=3/18/2021&EndDate=3/18/2021',
start: '2021-03-18'
},{
title: 'View',
url: 'https://www.nrc.gov/pmns/mtg?do=search.results&pageno=1&StartDate=3/19/2021&EndDate=3/19/2021',
start: '2021-03-19'
},{
title: 'View',
url: 'https://www.nrc.gov/pmns/mtg?do=search.results&pageno=1&StartDate=3/20/2021&EndDate=3/20/2021',
start: '2021-03-20'
},{
title: 'View',
url: 'https://www.nrc.gov/pmns/mtg?do=search.results&pageno=1&StartDate=3/21/2021&EndDate=3/21/2021',
start: '2021-03-21'
},{
title: 'View',
url: 'https://www.nrc.gov/pmns/mtg?do=search.results&pageno=1&StartDate=3/22/2021&EndDate=3/22/2021',
start: '2021-03-22'
},{
title: 'View',
url: 'https://www.nrc.gov/pmns/mtg?do=search.results&pageno=1&StartDate=3/23/2021&EndDate=3/23/2021',
start: '2021-03-23'
},{
title: 'View',
url: 'https://www.nrc.gov/pmns/mtg?do=search.results&pageno=1&StartDate=3/24/2021&EndDate=3/24/2021',
start: '2021-03-24'
},{
title: 'View',
url: 'https://www.nrc.gov/pmns/mtg?do=search.results&pageno=1&StartDate=3/25/2021&EndDate=3/25/2021',
start: '2021-03-25'
},{
title: 'View',
url: 'https://www.nrc.gov/pmns/mtg?do=search.results&pageno=1&StartDate=3/26/2021&EndDate=3/26/2021',
start: '2021-03-26'
},{
title: 'View',
url: 'https://www.nrc.gov/pmns/mtg?do=search.results&pageno=1&StartDate=3/27/2021&EndDate=3/27/2021',
start: '2021-03-27'
},{
title: 'View',
url: 'https://www.nrc.gov/pmns/mtg?do=search.results&pageno=1&StartDate=3/28/2021&EndDate=3/28/2021',
start: '2021-03-28'
},{
title: 'View',
url: 'https://www.nrc.gov/pmns/mtg?do=search.results&pageno=1&StartDate=3/29/2021&EndDate=3/29/2021',
start: '2021-03-29'
},{
title: 'View',
url: 'https://www.nrc.gov/pmns/mtg?do=search.results&pageno=1&StartDate=3/30/2021&EndDate=3/30/2021',
start: '2021-03-30'
},{
title: 'View',
url: 'https://www.nrc.gov/pmns/mtg?do=search.results&pageno=1&StartDate=3/31/2021&EndDate=3/31/2021',
start: '2021-03-31'
},{
title: 'View',
url: 'https://www.nrc.gov/pmns/mtg?do=search.results&pageno=1&StartDate=4/01/2021&EndDate=4/01/2021',
start: '2021-04-01'
},{
title: 'View',
url: 'https://www.nrc.gov/pmns/mtg?do=search.results&pageno=1&StartDate=4/02/2021&EndDate=4/02/2021',
start: '2021-04-02'
},{
title: 'View',
url: 'https://www.nrc.gov/pmns/mtg?do=search.results&pageno=1&StartDate=4/03/2021&EndDate=4/03/2021',
start: '2021-04-03'
},{
title: 'View',
url: 'https://www.nrc.gov/pmns/mtg?do=search.results&pageno=1&StartDate=4/04/2021&EndDate=4/04/2021',
start: '2021-04-04'
},{
title: 'View',
url: 'https://www.nrc.gov/pmns/mtg?do=search.results&pageno=1&StartDate=4/05/2021&EndDate=4/05/2021',
start: '2021-04-05'
},{
title: 'View',
url: 'https://www.nrc.gov/pmns/mtg?do=search.results&pageno=1&StartDate=4/06/2021&EndDate=4/06/2021',
start: '2021-04-06'
},{
title: 'View',
url: 'https://www.nrc.gov/pmns/mtg?do=search.results&pageno=1&StartDate=4/07/2021&EndDate=4/07/2021',
start: '2021-04-07'
},{
title: 'View',
url: 'https://www.nrc.gov/pmns/mtg?do=search.results&pageno=1&StartDate=4/08/2021&EndDate=4/08/2021',
start: '2021-04-08'
},{
title: 'View',
url: 'https://www.nrc.gov/pmns/mtg?do=search.results&pageno=1&StartDate=4/09/2021&EndDate=4/09/2021',
start: '2021-04-09'
},{
title: 'View',
url: 'https://www.nrc.gov/pmns/mtg?do=search.results&pageno=1&StartDate=4/10/2021&EndDate=4/10/2021',
start: '2021-04-10'
},{
title: 'View',
url: 'https://www.nrc.gov/pmns/mtg?do=search.results&pageno=1&StartDate=4/11/2021&EndDate=4/11/2021',
start: '2021-04-11'
},{
title: 'View',
url: 'https://www.nrc.gov/pmns/mtg?do=search.results&pageno=1&StartDate=4/12/2021&EndDate=4/12/2021',
start: '2021-04-12'
},{
title: 'View',
url: 'https://www.nrc.gov/pmns/mtg?do=search.results&pageno=1&StartDate=4/13/2021&EndDate=4/13/2021',
start: '2021-04-13'
},{
title: 'View',
url: 'https://www.nrc.gov/pmns/mtg?do=search.results&pageno=1&StartDate=4/14/2021&EndDate=4/14/2021',
start: '2021-04-14'
},{
title: 'View',
url: 'https://www.nrc.gov/pmns/mtg?do=search.results&pageno=1&StartDate=4/15/2021&EndDate=4/15/2021',
start: '2021-04-15'
},{
title: 'View',
url: 'https://www.nrc.gov/pmns/mtg?do=search.results&pageno=1&StartDate=4/16/2021&EndDate=4/16/2021',
start: '2021-04-16'
},{
title: 'View',
url: 'https://www.nrc.gov/pmns/mtg?do=search.results&pageno=1&StartDate=4/17/2021&EndDate=4/17/2021',
start: '2021-04-17'
},{
title: 'View',
url: 'https://www.nrc.gov/pmns/mtg?do=search.results&pageno=1&StartDate=4/18/2021&EndDate=4/18/2021',
start: '2021-04-18'
},{
title: 'View',
url: 'https://www.nrc.gov/pmns/mtg?do=search.results&pageno=1&StartDate=4/19/2021&EndDate=4/19/2021',
start: '2021-04-19'
},{
title: 'View',
url: 'https://www.nrc.gov/pmns/mtg?do=search.results&pageno=1&StartDate=4/20/2021&EndDate=4/20/2021',
start: '2021-04-20'
},{
title: 'View',
url: 'https://www.nrc.gov/pmns/mtg?do=search.results&pageno=1&StartDate=4/21/2021&EndDate=4/21/2021',
start: '2021-04-21'
},{
title: 'View',
url: 'https://www.nrc.gov/pmns/mtg?do=search.results&pageno=1&StartDate=4/22/2021&EndDate=4/22/2021',
start: '2021-04-22'
},{
title: 'View',
url: 'https://www.nrc.gov/pmns/mtg?do=search.results&pageno=1&StartDate=4/23/2021&EndDate=4/23/2021',
start: '2021-04-23'
},{
title: 'View',
url: 'https://www.nrc.gov/pmns/mtg?do=search.results&pageno=1&StartDate=4/24/2021&EndDate=4/24/2021',
start: '2021-04-24'
},{
title: 'View',
url: 'https://www.nrc.gov/pmns/mtg?do=search.results&pageno=1&StartDate=4/25/2021&EndDate=4/25/2021',
start: '2021-04-25'
},{
title: 'View',
url: 'https://www.nrc.gov/pmns/mtg?do=search.results&pageno=1&StartDate=4/26/2021&EndDate=4/26/2021',
start: '2021-04-26'
},{
title: 'View',
url: 'https://www.nrc.gov/pmns/mtg?do=search.results&pageno=1&StartDate=4/27/2021&EndDate=4/27/2021',
start: '2021-04-27'
},{
title: 'View',
url: 'https://www.nrc.gov/pmns/mtg?do=search.results&pageno=1&StartDate=4/28/2021&EndDate=4/28/2021',
start: '2021-04-28'
},{
title: 'View',
url: 'https://www.nrc.gov/pmns/mtg?do=search.results&pageno=1&StartDate=4/29/2021&EndDate=4/29/2021',
start: '2021-04-29'
},{
title: 'View',
url: 'https://www.nrc.gov/pmns/mtg?do=search.results&pageno=1&StartDate=4/30/2021&EndDate=4/30/2021',
start: '2021-04-30'
},{
title: 'View',
url: 'https://www.nrc.gov/pmns/mtg?do=search.results&pageno=1&StartDate=5/01/2021&EndDate=5/01/2021',
start: '2021-05-01'
},{
title: 'View',
url: 'https://www.nrc.gov/pmns/mtg?do=search.results&pageno=1&StartDate=5/02/2021&EndDate=5/02/2021',
start: '2021-05-02'
},{
title: 'View',
url: 'https://www.nrc.gov/pmns/mtg?do=search.results&pageno=1&StartDate=5/03/2021&EndDate=5/03/2021',
start: '2021-05-03'
},{
title: 'View',
url: 'https://www.nrc.gov/pmns/mtg?do=search.results&pageno=1&StartDate=5/04/2021&EndDate=5/04/2021',
start: '2021-05-04'
},{
title: 'View',
url: 'https://www.nrc.gov/pmns/mtg?do=search.results&pageno=1&StartDate=5/05/2021&EndDate=5/05/2021',
start: '2021-05-05'
},{
title: 'View',
url: 'https://www.nrc.gov/pmns/mtg?do=search.results&pageno=1&StartDate=5/06/2021&EndDate=5/06/2021',
start: '2021-05-06'
},{
title: 'View',
url: 'https://www.nrc.gov/pmns/mtg?do=search.results&pageno=1&StartDate=5/07/2021&EndDate=5/07/2021',
start: '2021-05-07'
},{
title: 'View',
url: 'https://www.nrc.gov/pmns/mtg?do=search.results&pageno=1&StartDate=5/08/2021&EndDate=5/08/2021',
start: '2021-05-08'
},{
title: 'View',
url: 'https://www.nrc.gov/pmns/mtg?do=search.results&pageno=1&StartDate=5/09/2021&EndDate=5/09/2021',
start: '2021-05-09'
},{
title: 'View',
url: 'https://www.nrc.gov/pmns/mtg?do=search.results&pageno=1&StartDate=5/10/2021&EndDate=5/10/2021',
start: '2021-05-10'
},{
title: 'View',
url: 'https://www.nrc.gov/pmns/mtg?do=search.results&pageno=1&StartDate=5/11/2021&EndDate=5/11/2021',
start: '2021-05-11'
},{
title: 'View',
url: 'https://www.nrc.gov/pmns/mtg?do=search.results&pageno=1&StartDate=5/12/2021&EndDate=5/12/2021',
start: '2021-05-12'
},{
title: 'View',
url: 'https://www.nrc.gov/pmns/mtg?do=search.results&pageno=1&StartDate=5/13/2021&EndDate=5/13/2021',
start: '2021-05-13'
},{
title: 'View',
url: 'https://www.nrc.gov/pmns/mtg?do=search.results&pageno=1&StartDate=5/14/2021&EndDate=5/14/2021',
start: '2021-05-14'
},{
title: 'View',
url: 'https://www.nrc.gov/pmns/mtg?do=search.results&pageno=1&StartDate=5/15/2021&EndDate=5/15/2021',
start: '2021-05-15'
},{
title: 'View',
url: 'https://www.nrc.gov/pmns/mtg?do=search.results&pageno=1&StartDate=5/16/2021&EndDate=5/16/2021',
start: '2021-05-16'
},{
title: 'View',
url: 'https://www.nrc.gov/pmns/mtg?do=search.results&pageno=1&StartDate=5/17/2021&EndDate=5/17/2021',
start: '2021-05-17'
},{
title: 'View',
url: 'https://www.nrc.gov/pmns/mtg?do=search.results&pageno=1&StartDate=5/18/2021&EndDate=5/18/2021',
start: '2021-05-18'
},{
title: 'View',
url: 'https://www.nrc.gov/pmns/mtg?do=search.results&pageno=1&StartDate=5/19/2021&EndDate=5/19/2021',
start: '2021-05-19'
},{
title: 'View',
url: 'https://www.nrc.gov/pmns/mtg?do=search.results&pageno=1&StartDate=5/20/2021&EndDate=5/20/2021',
start: '2021-05-20'
},{
title: 'View',
url: 'https://www.nrc.gov/pmns/mtg?do=search.results&pageno=1&StartDate=5/21/2021&EndDate=5/21/2021',
start: '2021-05-21'
},{
title: 'View',
url: 'https://www.nrc.gov/pmns/mtg?do=search.results&pageno=1&StartDate=5/22/2021&EndDate=5/22/2021',
start: '2021-05-22'
},{
title: 'View',
url: 'https://www.nrc.gov/pmns/mtg?do=search.results&pageno=1&StartDate=5/23/2021&EndDate=5/23/2021',
start: '2021-05-23'
},{
title: 'View',
url: 'https://www.nrc.gov/pmns/mtg?do=search.results&pageno=1&StartDate=5/24/2021&EndDate=5/24/2021',
start: '2021-05-24'
},{
title: 'View',
url: 'https://www.nrc.gov/pmns/mtg?do=search.results&pageno=1&StartDate=5/25/2021&EndDate=5/25/2021',
start: '2021-05-25'
},{
title: 'View',
url: 'https://www.nrc.gov/pmns/mtg?do=search.results&pageno=1&StartDate=5/26/2021&EndDate=5/26/2021',
start: '2021-05-26'
},{
title: 'View',
url: 'https://www.nrc.gov/pmns/mtg?do=search.results&pageno=1&StartDate=5/27/2021&EndDate=5/27/2021',
start: '2021-05-27'
},{
title: 'View',
url: 'https://www.nrc.gov/pmns/mtg?do=search.results&pageno=1&StartDate=5/28/2021&EndDate=5/28/2021',
start: '2021-05-28'
},{
title: 'View',
url: 'https://www.nrc.gov/pmns/mtg?do=search.results&pageno=1&StartDate=5/29/2021&EndDate=5/29/2021',
start: '2021-05-29'
},{
title: 'View',
url: 'https://www.nrc.gov/pmns/mtg?do=search.results&pageno=1&StartDate=5/30/2021&EndDate=5/30/2021',
start: '2021-05-30'
},{
title: 'View',
url: 'https://www.nrc.gov/pmns/mtg?do=search.results&pageno=1&StartDate=5/31/2021&EndDate=5/31/2021',
start: '2021-05-31'
},{
title: 'View',
url: 'https://www.nrc.gov/pmns/mtg?do=search.results&pageno=1&StartDate=6/01/2021&EndDate=6/01/2021',
start: '2021-06-01'
},{
title: 'View',
url: 'https://www.nrc.gov/pmns/mtg?do=search.results&pageno=1&StartDate=6/02/2021&EndDate=6/02/2021',
start: '2021-06-02'
},{
title: 'View',
url: 'https://www.nrc.gov/pmns/mtg?do=search.results&pageno=1&StartDate=6/03/2021&EndDate=6/03/2021',
start: '2021-06-03'
},{
title: 'View',
url: 'https://www.nrc.gov/pmns/mtg?do=search.results&pageno=1&StartDate=6/04/2021&EndDate=6/04/2021',
start: '2021-06-04'
},{
title: 'View',
url: 'https://www.nrc.gov/pmns/mtg?do=search.results&pageno=1&StartDate=6/05/2021&EndDate=6/05/2021',
start: '2021-06-05'
},{
title: 'View',
url: 'https://www.nrc.gov/pmns/mtg?do=search.results&pageno=1&StartDate=6/06/2021&EndDate=6/06/2021',
start: '2021-06-06'
},{
title: 'View',
url: 'https://www.nrc.gov/pmns/mtg?do=search.results&pageno=1&StartDate=6/07/2021&EndDate=6/07/2021',
start: '2021-06-07'
},{
title: 'View',
url: 'https://www.nrc.gov/pmns/mtg?do=search.results&pageno=1&StartDate=6/08/2021&EndDate=6/08/2021',
start: '2021-06-08'
},{
title: 'View',
url: 'https://www.nrc.gov/pmns/mtg?do=search.results&pageno=1&StartDate=6/09/2021&EndDate=6/09/2021',
start: '2021-06-09'
},{
title: 'View',
url: 'https://www.nrc.gov/pmns/mtg?do=search.results&pageno=1&StartDate=6/10/2021&EndDate=6/10/2021',
start: '2021-06-10'
},{
title: 'View',
url: 'https://www.nrc.gov/pmns/mtg?do=search.results&pageno=1&StartDate=6/11/2021&EndDate=6/11/2021',
start: '2021-06-11'
},{
title: 'View',
url: 'https://www.nrc.gov/pmns/mtg?do=search.results&pageno=1&StartDate=6/12/2021&EndDate=6/12/2021',
start: '2021-06-12'
},{
title: 'View',
url: 'https://www.nrc.gov/pmns/mtg?do=search.results&pageno=1&StartDate=6/13/2021&EndDate=6/13/2021',
start: '2021-06-13'
},{
title: 'View',
url: 'https://www.nrc.gov/pmns/mtg?do=search.results&pageno=1&StartDate=6/14/2021&EndDate=6/14/2021',
start: '2021-06-14'
},{
title: 'View',
url: 'https://www.nrc.gov/pmns/mtg?do=search.results&pageno=1&StartDate=6/15/2021&EndDate=6/15/2021',
start: '2021-06-15'
},{
title: 'View',
url: 'https://www.nrc.gov/pmns/mtg?do=search.results&pageno=1&StartDate=6/16/2021&EndDate=6/16/2021',
start: '2021-06-16'
},{
title: 'View',
url: 'https://www.nrc.gov/pmns/mtg?do=search.results&pageno=1&StartDate=6/17/2021&EndDate=6/17/2021',
start: '2021-06-17'
},{
title: 'View',
url: 'https://www.nrc.gov/pmns/mtg?do=search.results&pageno=1&StartDate=6/18/2021&EndDate=6/18/2021',
start: '2021-06-18'
},{
title: 'View',
url: 'https://www.nrc.gov/pmns/mtg?do=search.results&pageno=1&StartDate=6/19/2021&EndDate=6/19/2021',
start: '2021-06-19'
},{
title: 'View',
url: 'https://www.nrc.gov/pmns/mtg?do=search.results&pageno=1&StartDate=6/20/2021&EndDate=6/20/2021',
start: '2021-06-20'
},{
title: 'View',
url: 'https://www.nrc.gov/pmns/mtg?do=search.results&pageno=1&StartDate=6/21/2021&EndDate=6/21/2021',
start: '2021-06-21'
},{
title: 'View',
url: 'https://www.nrc.gov/pmns/mtg?do=search.results&pageno=1&StartDate=6/22/2021&EndDate=6/22/2021',
start: '2021-06-22'
}, 

        ]
}
        </script>
       </div>
      </div>
     </div>
     <style type="text/css">
      div.scbwwbt-content-button a
{
  padding:14px 26px 16px 26px;
}
     </style>
     <div class="container">
      <div class="row">
       <div class="col-md-12">
        <div class="scbwwbt scbwwbt-bg-image dark-bg img-bg img-bg-soft">
         <span an="" and="" appears="" aria-label="on a blue and black background with white contrasting text at left of banner text displaying " around="" as="" atom="" banner="" bubble="" case="" center="" commission="" conference="" conference:="" for="" golden="" in="" information="" information:="" it="" letter="" march="" missed="" nuclear="" of="" on="" our="" possibility="" power="" regulatory="" ric="" right="" role="img" text="" the="" top="" us="" vertical="" very="" virtual="" with="" www.nrc.gov="" yellow="" you="">
          <span>
          </span>
          <style type="text/css">
           .scbwwbt-bg-image {
            background: url(/cdn/site/home-page/ric-2021-end-mobile.jpg);
            background-repeat: no-repeat !important;
          }
          
          @media only screen and (min-width: 62.5em) {
            .scbwwbt-bg-image {
              background: url(/cdn/site/home-page/ric-2021-end.jpg);
            }
          }
          </style>
          <div class="scbwwbt-content vert-center horiz-center">
           <div class="scbwwbt-content-button">
            <a class="btn btn-medium quaternary-background black" href="/public-involve/conference-symposia/ric/index.html" target="_self">
             Learn More
            </a>
           </div>
          </div>
         </span>
        </div>
       </div>
      </div>
     </div>
     <div class="container">
      <div class="row inner-top-xs">
       <div class="col-md-3 col-sm-6">
        <div class="tile-card mg-trigger" id="tile141310">
         <a href="/reading-rm/doc-collections/event-status/index.html">
          <img alt="Image of person typing on a laptop sitting at a table with a smartphone on the left side and a cup of coffee on the right side of the table." class="img-responsive" src="/cdn/site/home-page/generic-event-report2.jpg" title=""/>
         </a>
         <div class="tile-card-content">
          <span class="tile-card-title">
           Event Reports
          </span>
          <span class="tile-card-name">
           Reports Associated with Events.
          </span>
         </div>
         <a class="tile-card-button btn btn-small quaternary-background black" href="/reading-rm/doc-collections/event-status/index.html">
          Read More
         </a>
        </div>
       </div>
       <div class="col-md-3 col-sm-6">
        <div class="tile-card mg-trigger" id="tile141311">
         <a href="/reading-rm/adams.html">
          <img alt="Image of computer server room with twelve large tall black servers with small blue lights sitting on a grey floor." class="img-responsive" src="/cdn/site/home-page/adams2.jpg" title=""/>
         </a>
         <div class="tile-card-content">
          <span class="tile-card-title">
           ADAMS Public Documents
          </span>
          <span class="tile-card-name">
           Search and view NRC's public documents
          </span>
         </div>
         <a class="tile-card-button btn btn-small quaternary-background black" href="/reading-rm/adams.html">
          Read More
         </a>
        </div>
       </div>
       <div class="col-md-3 col-sm-6">
        <div class="tile-card mg-trigger" id="tile141312">
         <a href="/public-involve/open.html">
          <img alt="Image of the Nuclear Regulatory Commission's outdoor building signage at their headquarters in Maryland with an American Flag flying next to it." class="img-responsive" src="/cdn/site/home-page/open-government.jpg" title=""/>
         </a>
         <div class="tile-card-content">
          <span class="tile-card-title">
           Open Government
          </span>
          <span class="tile-card-name">
           NRC Approach to Open/Digital Government
          </span>
         </div>
         <a class="tile-card-button btn btn-small quaternary-background black" href="/public-involve/open.html">
          Read More
         </a>
        </div>
       </div>
       <div class="col-md-3 col-sm-6">
        <div class="tile-card mg-trigger" id="tile141313">
         <a href="/about-nrc/regulatory/licensing/fees.html#ebilling">
          <img alt="Image of person holding a tablet computer in their left hand and a credit card in their right hand." class="img-responsive" src="/cdn/site/home-page/new-reactor-license.jpg" title=""/>
         </a>
         <div class="tile-card-content">
          <span class="tile-card-title">
           eBilling
          </span>
          <span class="tile-card-name">
           Invoices available On-Line
          </span>
         </div>
         <a class="tile-card-button btn btn-small quaternary-background black" href="/about-nrc/regulatory/licensing/fees.html#ebilling">
          Learn More
         </a>
        </div>
       </div>
       <div class="col-md-3 col-sm-6">
        <div class="tile-card mg-trigger" id="tile141314">
         <a href="/reading-rm/basic-ref/students.html">
          <img alt="Image of two your girls in yellow protective coats holding remote controls." class="img-responsive" src="/cdn/site/home-page/students2.jpg" title=""/>
         </a>
         <div class="tile-card-content">
          <span class="tile-card-title">
           The Student Corner
          </span>
          <span class="tile-card-name">
           Information for Students and Teachers
          </span>
         </div>
         <a class="tile-card-button btn btn-small quaternary-background black" href="/reading-rm/basic-ref/students.html">
          Read More
         </a>
        </div>
       </div>
       <div class="col-md-3 col-sm-6">
        <div class="tile-card mg-trigger" id="tile141315">
         <a href="/about-nrc/emerg-preparedness/in-radiological-emerg.html">
          <img alt="Image of a red emergency light on a black background." class="img-responsive" src="/cdn/site/home-page/nrc-emergency2.jpg" title=""/>
         </a>
         <div class="tile-card-content">
          <span class="tile-card-title">
           In a Nuclear Emergency...
          </span>
          <span class="tile-card-name">
           Know what to do
          </span>
         </div>
         <a class="tile-card-button btn btn-small quaternary-background black" href="/about-nrc/emerg-preparedness/in-radiological-emerg.html">
          Read More
         </a>
        </div>
       </div>
       <div class="col-md-3 col-sm-6">
        <div class="tile-card mg-trigger" id="tile141316">
         <a href="/reading-rm/doc-collections/nuregs/staff/sr1350/index.html">
          <img alt="Image with text on it that reads 2020-2021 information digest." class="img-responsive" src="/cdn/site/home-page/information-digest2.jpg" title=""/>
         </a>
         <div class="tile-card-content">
          <span class="tile-card-title">
           Information Digest
          </span>
          <span class="tile-card-name">
           Agency Data at a Glance
          </span>
         </div>
         <a class="tile-card-button btn btn-small quaternary-background black" href="/reading-rm/doc-collections/nuregs/staff/sr1350/index.html">
          Read More
         </a>
        </div>
       </div>
       <div class="col-md-3 col-sm-6">
        <div class="tile-card mg-trigger" id="tile141317">
         <a href="/info-finder.html">
          <img alt="Image of map with with the states of Iowa, Illinois, Indiana, Ohio, Missouri, Arkansas, Mississippi, Alabama, South Carolina, North Carolina, and the District of Columbia visible with a magnifying glass over the word Philadelphia." class="img-responsive" src="/cdn/site/home-page/facility-locator.jpg" title=""/>
         </a>
         <div class="tile-card-content">
          <span class="tile-card-title">
           Facility Locator
          </span>
          <span class="tile-card-name">
           Locate a facility near you
          </span>
         </div>
         <a class="tile-card-button btn btn-small quaternary-background black" href="/info-finder.html">
          Locate Now
         </a>
